,ticker,name
1026,DWAS,DWAS (Invesco DWA SmallCap Momentum ETF)
1027,HUSE,HUSE (US Equity Rotation Strategy ETF)
1028,MDIV,MDIV (First Trust Multi-Asset Diversified Income Index Fund)
1029,TDIV,TDIV (First Trust NASDAQ Technology Dividend Index Fund)
1030,DWPP,DWPP (First Trust Dorsey Wright Peoples Portfolio ETF)
1031,FM,FM (iShares MSCI Frontier 100 ETF)
1032,VEGA,VEGA (AdvisorShares STAR Global Buy-Write ETF)
1033,CXSE,CXSE (WisdomTree China ex-State-Owned Enterprises Fund)
1034,TLTD,TLTD (FlexShares Morningstar Developed Markets ex-US Factor Tilt Index Fund)
1035,TLTE,TLTE (FlexShares Morningstar Emerging Markets Factor Tilt Index Fund)
1036,QMN,QMN (IQ Hedge Market Neutral Tracker ETF)
1037,RAVI,RAVI (FlexShares Ready Access Variable Income Fund)
1038,CAPE,CAPE (Barclays ETN+ Shiller CAPETM ETN)
1039,MORL,MORL (ETRACS Monthly Pay 2xLeveraged Mortgage REIT ETN)
1040,VTIP,VTIP (Vanguard Short-Term Inflation-Protected Securities ETF)
1041,IEFA,IEFA (iShares Core MSCI EAFE ETF)
1042,IEMG,IEMG (iShares Core MSCI Emerging Markets ETF)
1043,ISTB,ISTB (iShares Core 1-5 Year USD Bond ETF)
1044,IXUS,IXUS (iShares Core MSCI Total International Stock ETF)
1045,SPHD,SPHD (Invesco S&P 500 High Dividend Low Volatility ETF)
1046,MMTM,MMTM (SPDR S&P 1500 Momentum Tilt ETF)
1047,VLU,VLU (SPDR S&P 1500 Value Tilt ETF)
1048,SNLN,SNLN (Highland/iBoxx Senior Loan ETF)
1049,SILJ,SILJ (ETFMG Prime Junior Silver ETF)
1050,PHDG,PHDG (Invesco S&P 500 Downside Hedged ETF)
1051,MRGR,MRGR (ProShares Merger ETF)
1052,QDEF,QDEF (FlexShares Quality Dividend Defensive Index Fund)
1053,QDF,QDF (FlexShares Quality Dividend Index Fund)
1054,QDYN,QDYN (FlexShares Quality Dividend Dynamic Index Fund)
1055,IMLP,IMLP (iPath S&P MLP ETN)
1056,FLAG,FLAG (Forensic Accounting Long-Short ETF)
1057,GLDI,GLDI (Credit Suisse X-Links Gold Shares Covered Call ETN)
1058,BIZD,BIZD (VanEck Vectors BDC Income ETF)
1059,FPE,FPE (First Trust Preferred Securities and Income ETF)
1060,FXSG,FXSG (Invesco CurrencyShares Singapore Dollar Trust)
1061,YMLI,YMLI (VanEck Vectors High Income Infrastructure MLP ETF)
1062,XMLV,XMLV (Invesco S&P MidCap Low Volatility ETF)
1063,XSLV,XSLV (Invesco S&P SmallCap Low Volatility ETF)
1064,LGLV,LGLV (SPDR SSGA US Large Cap Low Volatility Index ETF)
1065,SMLV,SMLV (SPDR SSGA US Small Cap Low Volatility Index ETF)
1066,HYLS,HYLS (First Trust Exchange-Traded Fund IV First Trust Tactical High Yield ETF)
1067,PEX,PEX (ProShares Global Listed Private Equity ETF)
1068,DIV,DIV (Global SuperDividend US ETF)
1069,ATMP,ATMP (Barclays ETN+ Select MLP ETNs)
1070,MINC,MINC (AdvisorShares Newfleet Multi-Sector Income ETF)
1071,NGE,NGE (Global X MSCI Nigeria ETF)
1072,SRLN,SRLN (SPDR Blackstone / GSO Senior Loan ETF)
1073,BRZU,BRZU (Direxion Daily Brazil Bull 3X Shares)
1074,KORU,KORU (Direxion Daily South Korea Bull 3X Shares)
1075,SLVO,SLVO (Credit Suisse X-Links Silver Shares Covered Call ETN)
1076,IQDF,IQDF (FlexShares International Quality Dividend Index Fund)
1077,IQDE,IQDE (FlexShares International Quality Dividend Defensive Index Fund)
1078,IQDY,IQDY (FlexShares International Quality Dividend Dynamic Index Fund)
1079,MTUM,MTUM (iShares Edge MSCI USA Momentum Factor ETF)
1080,SIZE,SIZE (iShares Edge MSCI USA Size Factor ETF)
1081,VLUE,VLUE (iShares Edge MSCI USA Value Factor ETF)
1082,IBCD,IBCD (iBonds Mar 2020 Term Corporate ex-Financials ETF)
1083,IBCE,IBCE (iBonds Mar 2023 Term Corporate ex-Financials ETF)
1084,FTSL,FTSL (First Trust Senior Loan ETF)
1085,SYLD,SYLD (Cambria Shareholder Yield ETF)
1086,DGRW,DGRW (WisdomTree U.S. Quality Dividend Growth Fund)
1087,HYHG,HYHG (ProShares High Yield-Interest Rate Hedged ETF)
1088,TIPX,TIPX (SPDR Bloomberg Barclays 1-10 Year TIPS ETF)
1089,WDIV,WDIV (SPDR S&P Global Dividend ETF)
1090,BNDX,BNDX (Vanguard Total International Bond ETF)
1091,VWOB,VWOB (Vanguard Emerging Markets Government Bond ETF)
1092,RVNU,RVNU (X-trackers Municipal Infrastructure Revenue Bond Fund)
1093,BFOR,BFOR (Barrons 400 ETF)
1094,PGHY,PGHY (Invesco Global Short Term High Yield Bond ETF)
1095,ICOL,ICOL (iShares MSCI Colombia Capped ETF)
1096,YYY,YYY (Yield Shares High Income ETF)
1097,HSPX,HSPX (Horizons S&P 500 Covered Call ETF)
1098,JPNL,JPNL (Direxion Daily Japan 3x Bull Shares)
1099,ISRA,ISRA (VanEck Vectors Israel ETF)
1100,DXJS,DXJS (WisdomTree Japan Hedged SmallCap Equity Fund)
1101,SPSM,SPSM (SPDR Portfolio Small Cap ETF)
1102,IBDC,IBDC (iBonds Mar 2020 Term Corporate ETF)
1103,IBDD,IBDD (iBonds Mar 2023 Term Corporate ETF)
1104,BSCL,BSCL (Invesco BulletShares 2021 Corporate Bond ETF)
1105,BSCM,BSCM (Invesco BulletShares 2022 Corporate Bond ETF)
1106,QUAL,QUAL (iShares Edge MSCI USA Quality Factor ETF)
1107,KFYP,KFYP (KraneShare Zacks New China ETF)
1108,DGRS,DGRS (WisdomTree U.S. SmallCap Quality Dividend Growth Fund)
1109,KWEB,KWEB (KraneShares CSI China Internet ETF)
1110,DGRE,DGRE (WisdomTree Emerging Markets Quality Dividend Growth Fund)
1111,MLPX,MLPX (Global X MLP & Energy Infrastructure ETF)
1112,FMF,FMF (First Trust Morningstar Managed Futures Strategy Fund)
1113,CMDT,CMDT (iShares Commodity Optimized Trust)
1114,FNDB,FNDB (Schwab Fundamental U.S. Broad Market Index ETF)
1115,FNDX,FNDX (Schwab Fundamental U.S. Large Company Index)
1116,FNDA,FNDA (Schwab Fundamental U.S. Small Company Index)
1117,FNDF,FNDF (Schwab Fundamental International Large Company Index)
1118,FNDC,FNDC (Schwab Fundamental International Small Cap Company index)
1119,FNDE,FNDE (Schwab Fundamental Emerging Markets Large Company Index ETF)
1120,IDOG,IDOG (ALPS International Sector Dividend Dogs ETF)
1121,FID,FID (First Trust S&P International Dividend Aristocrats ETF)
1122,BSJJ,BSJJ (Invesco BulletShares 2019 High Yield Corporate Bond ETF)
1123,BSJK,BSJK (Invesco BulletShares 2020 High Yield Corporate Bond ETF)
1124,NEAR,NEAR (iShares Short Maturity Bond ETF)
1125,MLPC,MLPC (C-Tracks ETNs based on Performance of the Miller/Howard MLP Fundamental Index)
1126,EMCG,EMCG (WisdomTree Emerging Markets Consumer Growth Fund)
1127,DBAP,DBAP (X-trackers MSCI Asia Pacific ex Japan Hedged Equity Fund)
1128,DBEU,DBEU (X-trackers MSCI Europe Hedged Equity Fund)
1129,DBUK,DBUK (X-trackers MSCI United Kingdom Hedged Equity Fund)
1130,JNUG,JNUG (Direxion Daily Junior Gold Miners Index Bull 3x Shares)
1131,JDST,JDST (Direxion Daily Junior Gold Miners Index Bear 3x Shares)
1132,RDIV,RDIV (Oppenheimer S&P Ultra Dividend Revenue ETF)
1133,FIEG,FIEG (FI Enhanced Global High Yield Exchange Traded Notes)
1134,RIGS,RIGS (RiverFront Strategic Income Fund)
1135,NFRA,NFRA (FlexShares STOXX Global Broad Infrastructure Index Fund)
1136,NOBL,NOBL (ProShares S&P 500 Aristocrats ETF)
1137,ULST,ULST (SPDR SSgA Ultra Short Term Bond ETF)
1138,IPO,IPO (Renaissance IPO ETF)
1139,DXGE,DXGE (WisdomTree Germany Hedged Equity Fund)
1140,SHYG,SHYG (iShares 0-5 Year High Yield Corporate Bond ETF)
1141,SLQD,SLQD (iShares 0-5 Year Investment Grade Corporate Bond ETF)
1142,ROBO,ROBO (Robo-Stox Global Robotics & Automation Index ETF)
1143,FTGC,FTGC (First Trust Global Tactical Commodity Strategy Fund)
1144,FDIS,FDIS (Fidelity MSCI Consumer Discretionary Index ETF)
1145,FUTY,FUTY (Fidelity MSCI Utilities Index ETF)
1146,FSTA,FSTA (Fidelity MSCI Consumer Staples Index ETF)
1147,FENY,FENY (Fidelity MSCI Energy Index ETF)
1148,FNCL,FNCL (Fidelity MSCI Financials Index ETF)
1149,FHLC,FHLC (Fidelity MSCI Health Care Index ETF)
1150,FIDU,FIDU (Fidelity MSCI Industrials Index ETF)
1151,FTEC,FTEC (Fidelity MSCI Information Technology Index ETF)
1152,FMAT,FMAT (Fidelity MSCI Materials Index ETF)
1153,FCOM,FCOM (Fidelity MSCI Telecommunication Services Index ETF)
1154,VIDI,VIDI (Vident International Equity Fund)
1155,ENFR,ENFR (Alerian Energy Infrastructure ETF)
1156,FTSD,FTSD (Franklin Liberty Short Duration US Government ETF)
1157,ASHR,ASHR (X-trackers Harvest CSI 300 China A-Shares Fund)
1158,GQRE,GQRE (FlexShares Global Quality Real Estate Index Fund)
1159,IGHG,IGHG (ProShares Investment Grade Interest Rate Hedged)
1160,EMFM,EMFM (Global X Next Emerging & Frontier ETF)
1161,DVHL,DVHL (ETRACS Monthly Pay 2xLeveraged Diversified High Income ETN)
1162,PGAL,PGAL (Global X MSCI Portugal ETF)
1163,EMSH,EMSH (ProShares Short Term USD Emerging Markets Bond ETF)
1164,FYLD,FYLD (Cambria Foreign Shareholder Yield ETF)
1165,ICSH,ICSH (iShares Ultra Short-Term Bond ETF)
1166,QYLD,QYLD (Horizons Nasdaq-100 Covered Call ETF)
1167,HYND,HYND (WisdomTree Negative Duration High Yield Bond Fund)
1168,AGZD,AGZD (WisdomTree Interest Rate Hedged U.S. Aggregate Bond Fund)
1169,AGND,AGND (WisdomTree Negative Duration U.S. Aggregate Bond Fund)
1170,HYZD,HYZD (WisdomTree Interest Rate Hedged High Yield Bond Fund)
1171,USDU,USDU (WisdomTree Bloomberg U.S. Dollar Bullish Fund)
1172,FTHI,FTHI (First Trust BuyWrite Income ETF)
1173,FTLB,FTLB (First Trust Hedged BuyWrite Income ETF)
1174,SYG,SYG (SPDR MFS Systematic Growth Equity ETF)
1175,SYE,SYE (SPDR. MFS Systematic Core Equity ETF)
1176,SYV,SYV (SPDR MFS Systematic Value Equity ETF)
1177,SHYD,SHYD (VanEck Vectors Short High-Yield Municipal Index ETF)
1178,HOLD,HOLD (AdvisorShares Sage Core Reserves ETF)
1179,VUSE,VUSE (Vident Core US Equity ETF)
1180,EURL,EURL (Direxion Daily FTSE Europe Bull 3x Shares)
1181,LDUR,LDUR (PIMCO Low Duration Exchange-Traded Fund)
1182,DBKO,DBKO (X-trackers MSCI South Korea Hedged Equity Fund)
1183,DBAW,DBAW (X-trackers MSCI All World ex US Hedged Equity Fund)
1184,ZMLP,ZMLP (Direxion Zacks MLP High Income Shares)
1185,USFR,USFR (WisdomTree Bloomberg Floating Rate Treasury Fund)
1186,HEWJ,HEWJ (iShares Currency Hedged MSCI Japan ETF)
1187,HEWG,HEWG (iShares Currency Hedged MSCI Germany ETF)
1188,HEFA,HEFA (iShares Currency Hedged MSCI EAFE ETF)
1189,TFLO,TFLO (iShares Treasury Floating Rate Bond ETF)
1190,IBMH,IBMH (iShares iBonds Sep 2019 AMT-Free Muni Bond ETF)
1191,EQLT,EQLT (Workplace Equality Portfolio)
1192,IPKW,IPKW (Invesco International BuyBack Achievers ETF)
1193,FV,FV (First Trust Dorsey Wright Focus 5 ETF)
1194,DDIV,DDIV (First Trust Dorsey Wright Momentum & Dividend ETF)
1195,AIRR,AIRR (First Trust RBA American Industrial Renaissance ETF)
1196,GVAL,GVAL (Cambria Global Value ETF)
1197,TOLZ,TOLZ (DJ Brookfield Global Infrastructure ETF)
1198,EDOG,EDOG (ALPS Emerging Sector Dividend Dogs ETF)
1199,DXJF,DXJF (WisdomTree Japan Hedged Financials Fund)
1200,BYLD,BYLD (iShares Yield Optimized Bond ETF)
1201,CN,CN (Xtrackers MSCI All China Equity ETF)
1202,UAE,UAE (iShares MSCI UAE Capped ETF)
1203,QAT,QAT (iShares MSCI Qatar Capped ETF)
1204,VRP,VRP (Invesco Variable Rate Preferred ETF)
1205,IHDG,IHDG (WisdomTree International Hedged Quality Dividend Growth Fund)
1206,EUDG,EUDG (WisdomTree Europe Quality Dividend Growth Fund)
1207,FMB,FMB (First Trust Managed Municipal ETF)
1208,OUNZ,OUNZ (Van Eck Merk Gold Trust)
1209,ASHS,ASHS (X-trackers Harvest CSI 500 China-A Shares Small Cap Fund)
1210,HYGH,HYGH (iShares Interest Rate Hedged High Yield Bond ETF)
1211,LQDH,LQDH (iShares Interest Rate Hedged Corporate Bond ETF)
1212,IBDH,IBDH (iBonds Dec 2018 Term Corporate ETF)
1213,SPUU,SPUU (Direxion Daily S&P 500 Bull 2X Shares)
1214,LALT,LALT (Invesco Multi-Strategy Alternative ETF)
1215,JPMV,JPMV (iShares Edge MSCI Min Vol Japan ETF)
1216,AXJV,AXJV (iShares Edge MSCI Min Vol Asia ex Japan ETF)
1217,EUMV,EUMV (iShares Edge MSCI Min Vol Europe ETF)
1218,QEFA,QEFA (SPDR MSCI EAFE StrategicFactors ETF)
1219,QEMM,QEMM (SPDR MSCI Emerging Markets StrategicFactors ETF)
1220,QWLD,QWLD (SPDR MSCI World StrategicFactors ETF)
1221,SMEZ,SMEZ (SPDR EURO STOXX Small Cap ETF)
1222,DGRO,DGRO (iShares Core Dividend Growth ETF)
1223,IEUR,IEUR (iShares Core MSCI Europe ETF)
1224,IPAC,IPAC (iShares Core MSCI Pacific ETF)
1225,IUSB,IUSB (iShares Core Total USD Bond Market ETF)
1226,FBGX,FBGX (UBS AG FI Enhanced Large Cap Growth ETN)
1227,JPGE,JPGE (JPMorgan Diversified Return Global Equity ETF)
1228,LMLP,LMLP (ETRACS Monthly Pay 2xLeveraged Wells Fargo MLP Ex-Energy ETN)
1229,CFA,CFA (VictoryShares US 500 Volatility Wtd ETF)
1230,CFO,CFO (VictoryShares US 500 Enhanced Volatility Wtd ETF)
1231,CDC,CDC (VictoryShares US EQ Income Enhanced Volatility Wtd ETF)
1232,REET,REET (iShares Global REIT ETF)
1233,HEZU,HEZU (iShares Currency Hedged MSCI EMU ETF)
1234,WIL,WIL (Barclays Women in Leadership ETN)
1235,SGDM,SGDM (Sprott Gold Miners ETF)
1236,TAPR,TAPR (Barclays Inverse US Treasury Aggregate ETN)
1237,IFV,IFV (First Trust Dorsey Wright International Focus 5 ETF)
1238,CNXT,CNXT (VanEck Vectors ChinaAMC SME-ChiNext ETF)
1239,SMLL,SMLL (Direxion Small Cap Bull 2x Shares)
1240,CSF,CSF (VictoryShares US Discovery Enhanced Volatility Wtd ETF)
1241,FTSM,FTSM (First Trust Enhanced Short Maturity ETF)
1242,WYDE,WYDE (ProShares CDS Short North American HY Credit ETF)
1243,IBMI,IBMI (iBonds Sep 2020 Term Muni Bond ETF)
1244,FDIV,FDIV (First Trust Strategic Income ETF)
1245,EFAD,EFAD (ProShares MSCI EAFE Dividend Growers ETF)
1246,WBIA,WBIA (WBI BullBear Rising Income 2000 ETF)
1247,WBIB,WBIB (WBI BullBear Value 2000 ETF)
1248,WBIC,WBIC (WBI BullBear Yield 2000 ETF)
1249,WBID,WBID (WBI BullBear Quality 2000 ETF)
1250,WBIE,WBIE (WBI BullBear Rising Income 1000 ETF)
1251,WBIF,WBIF (WBI BullBear Value 1000 ETF)
1252,WBIG,WBIG (WBI BullBear Yield 1000 ETF)
1253,WBIL,WBIL (WBI BullBear Quality 1000 ETF)
1254,WBII,WBII (WBI BullBear Global Income ETF)
1255,WBIH,WBIH (WBI BullBear Global High Income ETF)
1256,MBSD,MBSD (FlexShares Disciplined Duration MBS Index Fund)
1257,LDRI,LDRI (Invesco LadderRite 0-5 Year Corporate Bond ETF)
1258,FTLS,FTLS (First Trust Long/Short Equity ETF)
1259,RODI,RODI (Barclays Return on Disability ETN)
1260,BSJL,BSJL (Invesco BulletShares 2021 High Yield Corporate Bond ETF)
1261,BSJM,BSJM (Invesco BulletShares 2022 High Yield Corporate Bond ETF)
1262,BSCN,BSCN (Invesco BulletShares 2023 Corporate Bond ETF)
1263,BSCO,BSCO (Invesco BulletShares 2024 Corporate Bond ETF)
1264,DIVC,DIVC (C-Tracks Exchange-Traded Notes   Miller/Howard Strategic Dividend Reinvestor)
1265,DVP,DVP (Deep Value ETF)
1266,HEEM,HEEM (iShares Currency Hedged MSCI Emerging Markets)
1267,ARKQ,ARKQ (ARK Industrial Innovation ETF)
1268,ARKW,ARKW (ARK Web x.0 ETF)
1269,DWAT,DWAT (Arrow DWA Tactical ETF)
1270,CIZ,CIZ (VictoryShares Developed Enhanced Volatility Wtd ETF)
1271,HDLV,HDLV (ETRACS Monthly Pay 2xLeveraged US High Dividend Low Volatility ETN)
1272,AMZA,AMZA (InfraCap MLP ETF)
1273,FBND,FBND (Fidelity Total Bond ETF)
1274,FLTB,FLTB (Fidelity Limited Term Bond ETF)
1275,FCOR,FCOR (Fidelity Corporate Bond ETF)
1276,ALTS,ALTS (ProShares Morningstar Alternatives Solution ETF)
1277,COMT,COMT (iShares Commodities Select Strategy ETF)
1278,VBND,VBND (Vident Core U.S. Bond Strategy ETF)
1279,FEUZ,FEUZ (First Trust Eurozone AlphaDEX ETF)
1280,QVAL,QVAL (Alpha Architect US Quantitative Value ETF)
1281,DAX,DAX (Horizons DAX Germany ETF)
1282,SCTO,SCTO (Global X   JPMorgan US Sector Rotator Index ETF)
1283,EFFE,EFFE (Global X   JPMorgan Efficiente Index ETF)
1284,ARKG,ARKG (ARK Genomic Revolution Multi-Sector ETF)
1285,ARKK,ARKK (ARK Innovation ETF)
1286,GMOM,GMOM (Cambria Global Momentum ETF)
1287,FPXI,FPXI (First Trust International IPO ETF)
1288,FEMB,FEMB (First Trust Emerging Markets Local Currency Bond ETF)
1289,LMBS,LMBS (First Trust Low Duration Opportunities ETF)
1290,PDBC,PDBC (Invesco Optimum Yield Diversified Commodity Strategy No K-1 ETF)
1291,JPIN,JPIN (Diversified Return International Equity ETF)
1292,CBON,CBON (VanEck Vectors ChinaAMC China Bond ETF)
1293,EMQQ,EMQQ (Emerging Markets Internet & Ecommerce ETF)
1294,HACK,HACK (ETFMG Prime Cyber Security ETF)
1295,SKOR,SKOR (FlexShares Credit-Scored US Corporate Bond Index Fund)
1296,LOWC,LOWC (SPDR MSCI ACWI Low Carbon Target ETF)
1297,KCNY,KCNY (KraneShares E Fund China Commercial Paper ETF)
1298,CRBN,CRBN (iShares MSCI ACWI Low Carbon Target ETF)
1299,IBDL,IBDL (iBonds Dec 2020 Term Corporate ETF)
1300,MLPO,MLPO (Credit Suisse S&P MLP ETN)
1301,GAA,GAA (Cambria Global Asset Allocation ETF)
1302,DBEZ,DBEZ (Xtrackers MSCI Eurozone Hedged Equity ETF)
1303,VALX,VALX (Validea Market Legends ETF)
1304,XSOE,XSOE (WisdomTree Emerging Markets ex-State-Owned Enterprises Fund)
1305,BBC,BBC (Virtus LifeSci Biotech Clinical Trials ETF)
1306,BBP,BBP (Virtus LifeSci Biotech Products ETF)
1307,IVAL,IVAL (Alpha Architect International Quantitative Value ETF)
1308,DIVY,DIVY (Reality Shares DIVS Exchange-Traded Fund)
1309,EQAL,EQAL (Invesco Russell 1000 Equal Weight ETF)
1310,SBIO,SBIO (ALPS Medical Breakthroughs ETF)
1311,JPEM,JPEM (JPMorgan Diversified Return Emerging Markets Equity ETF)
1312,HIPS,HIPS (GraniteShares HIPS US High Income ETF)
1313,PPLC,PPLC (Portfolio+ S&P 500 ETF)
1314,PPSC,PPSC (Portfolio+ S&P Small Cap ETF)
1315,IMTM,IMTM (iShares Edge MSCI Intl Momentum Factor ETF)
1316,IQLT,IQLT (iShares Edge MSCI Intl Quality Factor ETF)
1317,DIVA,DIVA (AGFiQ Hedged Dividend Income Fund)
1318,FREL,FREL (Fidelity MSCI Real Estate Index ETF)
1319,SMHD,SMHD (ETRACS Monthly Pay 2xLeveraged US Small Cap High Dividend ETN)
1320,SPYB,SPYB (SPDR S&P 500 Buyback ETF)
1321,REGL,REGL (ProShares S&P MidCap 400 Dividend Aristocrats ETF)
1322,SMDV,SMDV (ProShares Russell 2000 Dividend Growers ETF)
1323,GHII,GHII (Invesco S&P High Income Infrastructure ETF)
1324,GDXX,GDXX (Proshares Ultra Gold Miners)
1325,GDXS,GDXS (Proshares Ultrashort Gold Miners)
1326,KALL,KALL (KraneShares MSCI China All Shares Index ETF)
1327,FLRT,FLRT (Pacific Asset Enhanced Floating Rate ETF)
1328,RISE,RISE (Sit Rising Rate ETF)
1329,TOTL,TOTL (SPDR Doubleline Total Return Tactical ETF)
1330,FIBR,FIBR (iShares Edge U.S. Fixed Income Balanced Risk ETF)
1331,ROAM,ROAM (Hartford Multifactor Emerging Markets ETF)
1332,RODM,RODM (Hartford Multifactor Developed Markets (ex-US) ETF)
1333,ROUS,ROUS (Hartford Multifactor US Equity ETF)
1334,QVM,QVM (Arrow QVM Equity Factor ETF)
1335,HYIH,HYIH (X-trackers High Yield Corporate Bond - Interest Rate Hedged ETF)
1336,IGIH,IGIH (X-trackers Investment Grade Bond - Interest Rate Hedged ETF)
1337,EMIH,EMIH (X-trackers Emerging Markets Bond - Interest Rate Hedged ETF)
1338,MEAR,MEAR (iShares Short Maturity Municipal Bond ETF)
1339,EUSC,EUSC (WisdomTree Europe Hedged SmallCap Equity Fund)
1340,IBDK,IBDK (iBonds Dec 2019 Term Corporate ETF)
1341,IBDM,IBDM (iBonds Dec 2021 Term Corporate ETF)
1342,IBDN,IBDN (iBonds Dec 2022 Term Corporate ETF)
1343,IBDO,IBDO (iBonds Dec 2023 Term Corporate ETF)
1344,IBDP,IBDP (iBonds Dec 2024 Term Corporate ETF)
1345,IBDQ,IBDQ (iBonds Dec 2025 Term Corporate ETF)
1346,HOML,HOML (ETRACS Monthly Reset 2xLeveraged ISE Exclusively Homebuilders ETN)
1347,AFTY,AFTY (CSOP FTSE China A50 ETF)
1348,SDEM,SDEM (Global X MSCI SuperDividend Emerging Markets ETF)
1349,SRET,SRET (Global X SuperDividend REIT ETF)
1350,XT,XT (iShares Exponential Technologies ETF)
1351,QED,QED (IQ Hedge Event-Driven Tracker ETF)
1352,QLS,QLS (IQ Hedge Long/Short Tracker ETF)
1353,ROGS,ROGS (Hartford Multifactor Global Small Cap ETF)
1354,SGDJ,SGDJ (Sprott Junior Gold Miners ETF)
1355,XRLV,XRLV (Invesco S&P 500 ex-Rate Sensitive Low Volatility ETF)
1356,JHDG,JHDG (WisdomTree Japan Hedged Quality Dividend Growth Fund)
1357,FFTY,FFTY (Innovator IBD 50 ETF)
1358,CHAU,CHAU (Direxion Daily CSI 300 China A Share Bull 2x Shares)
1359,QUS,QUS (SPDR MSCI USA StrategicFactors ETF)
1360,SMCP,SMCP (AlphaMark Actively Managed Small Cap ETF)
1361,PAK,PAK (Global X MSCI Pakistan ETF)
1362,JETS,JETS (U.S. Global Jets ETF)
1363,LRGF,LRGF (iShares Edge MSCI Multifactor USA ETF)
1364,SMLF,SMLF (iShares Edge MSCI Multifactor USA Small-Cap ETF)
1365,INTF,INTF (iShares Edge MSCI Multifactor Intl ETF)
1366,ISCF,ISCF (iShares Edge MSCI Multifactor Intl Small-Cap ETF)
1367,ACWF,ACWF (iShares Edge MSCI Multifactor Global ETF)
1368,LRET,LRET (ETRACS Monthly Pay 2xLeveraged MSCI US REIT Index ETN)
1369,DHVW,DHVW (Diamond Hill Valuation-Weighted 500 ETF)
1370,SCIU,SCIU (Global X Scientific Beta US ETF)
1371,SCID,SCID (Global X Scientific Beta Europe ETF)
1372,SCIJ,SCIJ (Global X Scientific Beta Japan ETF)
1373,SCIX,SCIX (Global X Scientific Beta Asia ex-Japan ETF)
1374,YLCO,YLCO (Global X YieldCo Index ETF)
1375,LABU,LABU (Direxion Daily S&P Biotech Bull 3x Shares)
1376,LABD,LABD (Direxion Daily S&P Biotech Bear 3x Shares)
1377,GUSH,GUSH (Direxion Daily S&P Oil & Gas Exp. & Prod. Bull 3x Shares)
1378,DRIP,DRIP (Direxion Daily S&P Oil & Gas Exp. & Prod. Bear 3x Shares)
1379,ICVT,ICVT (iShares Convertible Bond ETF)
1380,PTNQ,PTNQ (Pacer Trendpilot 100 ETF)
1381,PTMC,PTMC (Pacer Trendpilot US Mid Cap ETF)
1382,PTLC,PTLC (Pacer Trendpilot US Large Cap ETF)
1383,CHAD,CHAD (Direxion Daily CSI 300 China A Share Bear 1x Shares)
1384,ISZE,ISZE (iShares Edge MSCI Intl Size Factor ETF)
1385,IVLU,IVLU (iShares Edge MSCI Intl Value Factor ETF)
1386,UBIO,UBIO (ProShares UltraPro NASDAQ Biotechnology)
1387,ZBIO,ZBIO (ProShares UltraPro Short Nasdaq Biotechnology)
1388,JPN,JPN (X-trackers Japan JPX-Nikkei 400 Equity ETF)
1389,HTUS,HTUS (Hull Tactical US ETF)
1390,TPYP,TPYP (Tortoise North American Pipeline Fund)
1391,HEWU,HEWU (iShares Currency Hedged MSCI United Kingdom ETF)
1392,HEWL,HEWL (iShares Currency Hedged MSCI Switzerland ETF)
1393,HEWP,HEWP (iShares Currency Hedged MSCI Spain ETF)
1394,HEWY,HEWY (iShares Currency Hedged MSCI South Korea ETF)
1395,HEWW,HEWW (iShares Currency Hedged MSCI Mexico ETF)
1396,HAUD,HAUD (iShares Currency Hedged MSCI Australia ETF)
1397,HEWC,HEWC (iShares Currency Hedged MSCI Canada ETF)
1398,HAWX,HAWX (iShares Currency Hedged MSCI ACWI ex U.S. ETF)
1399,HSCZ,HSCZ (iShares Currency Hedged MSCI EAFE Small-Cap ETF)
1400,HEWI,HEWI (iShares Currency Hedged MSCI Italy ETF)
1401,CIBR,CIBR (First Trust Nasdaq Cybersecurity ETF)
1402,CDL,CDL (VictoryShares US Large Cap High Div Volatility Wtd ETF)
1403,CSB,CSB (VictoryShares US Small Cap High Div Volatility Wtd ETF)
1404,CSA,CSA (VictoryShares US Small Cap Volatility Wtd)
1405,KLDW,KLDW (Knowledge Leaders Developed World ETF)
1406,YLD,YLD (Principal Edge Active Income ETF)
1407,AGGY,AGGY (WisdomTree Yield Enhanced U.S. Aggregate Bond Fund)
1408,ALTY,ALTY (Global X SuperDividend Alternatives ETF)
1409,OUSA,OUSA (O Shares FTSE US Quality Dividend ETF)
1410,MOTI,MOTI (VanEck Vectors Morningstar International Moat ETF)
1411,IPAY,IPAY (ETFMG Prime Mobile Payments ETF)
1412,HFXI,HFXI (IQ 50 Percent Hedged FTSE International ETF)
1413,HFXE,HFXE (IQ 50 Percent Hedged FTSE Europe ETF)
1414,HFXJ,HFXJ (IQ 50 Percent Hedged FTSE Japan ETF)
1415,EMBH,EMBH (iShares Interest Rate Hedged Emerging Markets Bond ETF)
1416,IGBH,IGBH (iShares Interest Rate Hedged Long-Term Corporate Bond ETF)
1417,NFLT,NFLT (Virtus Newfleet Multi-Sector Bond ETF)
1418,HDAW,HDAW (X-trackers MSCI All World ex US High Dividend Yield Equity ETF)
1419,HDEF,HDEF (X-trackers MSCI EAFE High Dividend Yield Equity ETF)
1420,EWRE,EWRE (Invesco S&P 500 Equal Weight Real Estate ETF)
1421,NAIL,NAIL (Direxion Daily Homebuilders & Supplies Bull 3x Shares)
1422,DPST,DPST (Direxion Daily Regional Banks Bull 3x Shares)
1423,WDRW,WDRW (Direxion Daily Regional Banks Bear 3x Shares)
1424,GRMY,GRMY (Xtrackers Germany Equity ETF)
1425,EURZ,EURZ (Xtrackers Eurozone Equity ETF)
1426,OASI,OASI (O Shares FTSE Asia Pacific Quality Dividend ETF)
1427,OEUR,OEUR (O Shares FTSE Europe Quality Dividend ETF)
1428,CRAK,CRAK (VanEck Vectors Oil Refiners ETF)
1429,CIL,CIL (VictoryShares International Volatility Wtd ETF)
1430,CID,CID (VictoryShares International High Div Volatility Wtd ETF)
1431,VTEB,VTEB (Vanguard Tax-Exempt Bond ETF)
1432,XCEM,XCEM (Columbia EM Core ex-China ETF)
1433,IBMJ,IBMJ (iBonds Dec 2021 Term Muni Bond ETF)
1434,IBMK,IBMK (iBonds Dec 2022 Term Muni Bond ETF)
1435,VAMO,VAMO (Cambria Value and Momentum ETF)
1436,EUDV,EUDV (ProShares MSCI Europe Dividend Growers ETF)
1437,KSA,KSA (iShares MSCI Saudi Arabia Capped ETF)
1438,GSLC,GSLC (Goldman Sachs ActiveBeta U.S. Large Cap Equity ETF)
1439,SPXE,SPXE (ProShares S&P 500 Ex-Energy ETF)
1440,SPXN,SPXN (Proshares S&P 500 EX-Financials ETF)
1441,SPXV,SPXV (Proshares S&P 500 EX-Health Care ETF)
1442,SPXT,SPXT (ProShares S&P 500 Ex-Technology ETF)
1443,UTES,UTES (Reaves Utilities ETF)
1444,LKOR,LKOR (FlexShares Credit-Scored US Long Corporate Bond Index Fund)
1445,QLC,QLC (FlexShares US Quality Large Cap Index Fund)
1446,JHMM,JHMM (John Hancock Multifactor Mid Cap ETF)
1447,JHML,JHML (John Hancock Multifactor Large Cap ETF)
1448,JHMT,JHMT (John Hancock Multifactor Technology ETF)
1449,JHMH,JHMH (John Hancock Multifactor Healthcare ETF)
1450,JHMF,JHMF (John Hancock Multifactor Financials ETF)
1451,JHMC,JHMC (John Hancock Multifactor Consumer Discretionary ETF)
1452,GEM,GEM (Goldman Sachs ActiveBeta Emerging Markets Equity ETF)
1453,JPUS,JPUS (JPMorgan Diversified Return US Equity ETF)
1454,QGTA,QGTA (IQ Leaders GTAA Tracker ETF)
1455,MLTI,MLTI (Credit Suisse X-Links Multi-Asset High Income ETN)
1456,HJPX,HJPX (iShares Currency Hedged JPX-Nikkei 400 ETF)
1457,BSJN,BSJN (Invesco BulletShares 2023 High Yield Corporate Bond ETF)
1458,BSCP,BSCP (Invesco BulletShares 2025 Corporate Bond ETF)
1459,XLRE,XLRE (Real Estate Select Sector SPDR Fund)
1460,SPMO,SPMO (Invesco S&P 500 Momentum ETF)
1461,SPVU,SPVU (Invesco S&P 500 Enhanced Value ETF)
1462,DWTR,DWTR (Invesco DWA Tactical Sector Rotation ETF)
1463,MLPB,MLPB (ETRACS Alerian MLP Infrastructure Index ETN Series B)
1464,AMUB,AMUB (ETRACS Alerian MLP Index ETN Series B)
1465,MRRL,MRRL (ETRACS Monthly Pay 2xLeveraged Mortgage REIT ETN Series B)
1466,UCIB,UCIB (ETRACS CMCI Total Return ETN Series B)
1467,BDCZ,BDCZ (ETRACS Linked to the Wells Fargo Business Development Company Index ETN Series B)
1468,LBDC,LBDC (ETRACS 2xLeveraged Long Wells Fargo Business Development Company Index ETN Series B)
1469,CNCR,CNCR (Loncar Cancer Immunotherapy ETF)
1470,CNHX,CNHX (CSOP MSCI China A International Hedged ETF)
1471,HAHA,HAHA (CSOP China CSI 300 A-H Dynamic ETF)
1472,ASHX,ASHX (X-Trackers MSCI China A Inclusion Equity ETF)
1473,SPYD,SPYD (SPDR Portfolio S&P 500 High Dividend ETF)
