,ticker,name
0,FLGE,FLGE (Credit Suisse FI Large Cap Growth Enhanced ETN)
1,RDVY,RDVY (First Trust NASDAQ Rising Dividend Achievers)
2,KBA,KBA (KraneShares Bosera MSCI China A ETF)
3,IPOS,IPOS (Renaissance International IPO ETF)
4,CEFL,CEFL (ETRACS Monthly Pay 2xLeveraged Closed-End Fund ETN)
5,SPY,SPY (SPDR S&P 500 ETF Trust)
6,MDY,MDY (SPDR S&P MidCap 400 ETF Trust)
7,EWS,EWS (iShares MSCI Singapore ETF)
8,EWW,EWW (iShares MSCI Mexico ETF)
9,EWM,EWM (iShares MSCI Malaysia ETF)
10,EWA,EWA (iShares MSCI Australia ETF)
11,EWL,EWL (iShares MSCI Switzerland ETF)
12,EWN,EWN (iShares MSCI Netherlands ETF)
13,EWH,EWH (iShares MSCI Hong Kong ETF)
14,EWU,EWU (iShares MSCI United Kingdom ETF)
15,EWD,EWD (iShares MSCI Sweden ETF)
16,EWG,EWG (iShares MSCI Germany ETF)
17,EWC,EWC (iShares MSCI Canada ETF)
18,EWO,EWO (iShares MSCI Austria ETF)
19,EWK,EWK (iShares MSCI Belgium ETF)
20,EWQ,EWQ (iShares MSCI France ETF)
21,EWI,EWI (iShares MSCI Italy ETF)
22,EWP,EWP (iShares MSCI Spain ETF)
23,EWJ,EWJ (iShares MSCI Japan ETF)
24,DIA,DIA (SPDR Dow Jones Industrial Average ETF Trust)
25,XLY,XLY (Consumer Discretionary Select Sector SPDR Fund)
26,XLP,XLP (Consumer Staples Select Sector SPDR Fund)
27,XLE,XLE (Energy Select Sector SPDR Fund)
28,XLF,XLF (Financial Select Sector SPDR Fund)
29,XLV,XLV (Health Care Select Sector SPDR Fund)
30,XLI,XLI (Industrial Select Sector SPDR Fund)
31,XLB,XLB (Materials Select Sector SPDR Fund)
32,XLK,XLK (Technology Select Sector SPDR Fund)
33,XLU,XLU (Utilities Select Sector SPDR Fund)
34,QQQ,QQQ (Invesco QQQ Trust)
35,EWY,EWY (iShares MSCI South Korea ETF)
36,IVV,IVV (iShares Core S&P 500 ETF)
37,IWB,IWB (iShares Russell 1000 ETF)
38,IYW,IYW (iShares US Technology ETF)
39,IYF,IYF (iShares US Financials ETF)
40,IVW,IVW (iShares S&P 500 Growth ETF)
41,IVE,IVE (iShares S&P 500 Value ETF)
42,IWD,IWD (iShares Russell 1000 Value ETF)
43,IJR,IJR (iShares Core S&P Small-Cap ETF)
44,IWF,IWF (iShares Russell 1000 Growth ETF)
45,IWV,IWV (iShares Russell 3000 ETF)
46,IJH,IJH (iShares Core S&P Mid-Cap ETF)
47,IWM,IWM (iShares Russell 2000 ETF)
48,IYZ,IYZ (iShares US Telecommunications ETF)
49,IYC,IYC (iShares U.S. Consumer Services ETF)
50,IYK,IYK (iShares US Consumer Goods ETF)
51,IYE,IYE (iShares U.S. Energy ETF)
52,IYG,IYG (iShares U.S. Financial Services ETF)
53,IYR,IYR (iShares US Real Estate ETF)
54,IYH,IYH (iShares U.S. Healthcare ETF)
55,IYJ,IYJ (iShares U.S. Industrials ETF)
56,IYM,IYM (iShares U.S. Basic Materials ETF)
57,IYY,IYY (iShares Dow Jones U.S. ETF)
58,IDU,IDU (iShares US Utilities ETF)
59,EWT,EWT (iShares MSCI Taiwan ETF)
60,EWZ,EWZ (iShares MSCI Brazil ETF)
61,IJT,IJT (iShares S&P Small-Cap 600 Growth ETF)
62,IJS,IJS (iShares S&P Small-Cap 600 Value ETF)
63,IUSG,IUSG (iShares Core S&P U.S. Growth ETF)
64,IWO,IWO (iShares Russell 2000 Growth ETF)
65,IJK,IJK (iShares S&P Mid-Cap 400 Growth ETF)
66,IUSV,IUSV (iShares Core S&P U.S. Value ETF)
67,IJJ,IJJ (iShares S&P Mid-Cap 400 Value ETF)
68,IWN,IWN (iShares Russell 2000 Value ETF)
69,EZU,EZU (iShares MSCI Eurozone ETF)
70,IEV,IEV (iShares Europe ETF)
71,SPYG,SPYG (SPDR Portfolio S&P 500 Growth ETF)
72,SLYG,SLYG (SPDR S&P 600 Small Cap Growth ETF)
73,SLYV,SLYV (SPDR S&P 600 Small CapValue ETF)
74,SPYV,SPYV (SPDR Portfolio S&P 500 Value ETF)
75,DGT,DGT (SPDR Global Dow ETF)
76,XNTK,XNTK (SPDR NYSE Technology ETF)
77,SPTM,SPTM (SPDR Portfolio Total Stock Market ETF)
78,OEF,OEF (iShares S&P 100 ETF)
79,IOO,IOO (iShares Global 100 ETF)
80,ICF,ICF (iShares Cohen & Steers REIT ETF)
81,IBB,IBB (iShares Nasdaq Biotechnology ETF)
82,IGM,IGM (iShares North American Tech ETF)
83,RWR,RWR (SPDR Dow Jones REIT ETF)
84,VTI,VTI (Vanguard Total Stock Market ETF)
85,IGN,IGN (iShares North American Tech-Multimedia Networking ETF)
86,SOXX,SOXX (iShares PHLX Semiconductor ETF)
87,IGV,IGV (iShares North American Tech-Software ETF)
88,IWR,IWR (iShares Russell Mid-Cap ETF)
89,IWS,IWS (iShares Russell Mid-Cap Value ETF)
90,IWP,IWP (iShares Russell Mid-Cap Growth ETF)
91,EFA,EFA (iShares MSCI EAFE ETF)
92,IGE,IGE (iShares North American Natural Resources ETF)
93,JPXN,JPXN (iShares JPX-Nikkei 400 ETF)
94,ILF,ILF (iShares Latin America 40 ETF)
95,EPP,EPP (iShares MSCI Pacific ex Japan ETF)
96,IXC,IXC (iShares Global Energy ETF)
97,IXG,IXG (iShares Global Financials ETF)
98,IXN,IXN (iShares Global Tech ETF)
99,IXP,IXP (iShares Global Telecom ETF)
100,IXJ,IXJ (iShares Global Healthcare ETF)
101,VXF,VXF (Vanguard Extended Market ETF)
102,TLT,TLT (iShares 20+ Year Treasury Bond ETF)
103,LQD,LQD (iShares iBoxx $ Investment Grade Corporate Bond ETF)
104,SHY,SHY (iShares 1-3 Year Treasury Bond ETF)
105,IEF,IEF (iShares 7-10 Year Treasury Bond ETF)
106,FEU,FEU (SPDR STOXX Europe 50 ETF)
107,FEZ,FEZ (SPDR EURO STOXX 50 ETF)
108,ADRE,ADRE (Invesco BLDRS Emerging Markets 50 ADR Index Fund)
109,ADRA,ADRA (Invesco BLDRS Asia 50 ADR Index Fund)
110,ADRU,ADRU (Invesco BLDRS Europe Select ADR Index Fund)
111,ADRD,ADRD (Invesco BLDRS Developed Markets 100 ADR Index Fund)
112,EZA,EZA (iShares MSCI South Africa ETF)
113,EEM,EEM (iShares MSCI Emerging Markets ETF)
114,RSP,RSP (Invesco S&P 500 Equal Weight ETF)
115,DWAQ,DWAQ (Invesco DWA NASDAQ Momentum ETF)
116,PWC,PWC (Invesco Dynamic Market ETF)
117,FVL,FVL (First Trust Value Line 100 Exchange-Traded Fund)
118,FVD,FVD (First Trust Value Line Dividend Index Fund)
119,AGG,AGG (iShares Core U.S. Aggregate Bond ETF)
120,ONEQ,ONEQ (Fidelity NASDAQ Composite Index Tracking Stock ETF)
121,IYT,IYT (iShares Transportation Average ETF)
122,DVY,DVY (iShares Select Dividend ETF)
123,TIP,TIP (iShares TIPS Bond ETF)
124,ITOT,ITOT (iShares Core S&P Total U.S. Stock Market ETF)
125,VCR,VCR (Vanguard Consumer Discretionary ETF)
126,VDC,VDC (Vanguard Consumer Staples ETF)
127,VFH,VFH (Vanguard Financials ETF)
128,VHT,VHT (Vanguard Health Care ETF)
129,VAW,VAW (Vanguard Materials ETF)
130,VB,VB (Vanguard Small-Cap ETF)
131,VBR,VBR (Vanguard Small-Cap Value ETF)
132,VTV,VTV (Vanguard Value ETF)
133,VUG,VUG (Vanguard Growth ETF)
134,VBK,VBK (Vanguard Small-Cap Growth ETF)
135,VO,VO (Vanguard Mid-Cap ETF)
136,VGT,VGT (Vanguard Information Technology ETF)
137,VPU,VPU (Vanguard Utilities ETF)
138,VV,VV (Vanguard Large-Cap ETF)
139,JKD,JKD (iShares Morningstar Large-Cap ETF)
140,JKE,JKE (iShares Morningstar Large-Cap Growth ETF)
141,JKF,JKF (iShares Morningstar Large-Cap Value ETF)
142,JKJ,JKJ (iShares Morningstar Small-Cap ETF)
143,JKG,JKG (iShares Morningstar Mid-Cap ETF)
144,JKH,JKH (iShares Morningstar Mid-Cap Growth ETF)
145,JKI,JKI (iShares Morningstar Mid-Cap Value ETF)
146,JKK,JKK (iShares Morningstar Small-Cap Growth ETF)
147,JKL,JKL (iShares Morningstar Small-Cap Value ETF)
148,VDE,VDE (Vanguard Energy ETF)
149,VNQ,VNQ (Vanguard Real Estate ETF)
150,VIS,VIS (Vanguard Industrials ETF)
151,VOX,VOX (Vanguard Communication Services ETF)
152,FXI,FXI (iShares China Large-Cap ETF)
153,GLD,GLD (SPDR Gold Shares)
154,PEY,PEY (Invesco High Yield Equity Dividend Achievers ETF)
155,PGJ,PGJ (Invesco Golden Dragon China ETF)
156,IBND,IBND (SPDR Bloomberg Barclays International Corporate Bond ETF)
157,IAU,IAU (iShares Gold Trust)
158,SUSA,SUSA (iShares MSCI USA ESG Select ETF)
159,PWB,PWB (Invesco Dynamic Large Cap Growth ETF)
160,PWV,PWV (Invesco Dynamic Large Cap Value ETF)
161,PBW,PBW (Invesco WilderHill Clean Energy ETF)
162,VPL,VPL (Vanguard FTSE Pacific ETF)
163,VGK,VGK (Vanguard FTSE Europe ETF)
164,VWO,VWO (Vanguard FTSE Emerging Markets ETF)
165,XLG,XLG (Invesco S&P 500 Top 50 ETF)
166,PEJ,PEJ (Invesco Dynamic Leisure and Entertainment ETF)
167,PBS,PBS (Invesco Dynamic Media ETF)
168,PBJ,PBJ (Invesco Dynamic Food & Beverage ETF)
169,PBE,PBE (Invesco Dynamic Biotechnology & Genome ETF)
170,PJP,PJP (Invesco Dynamic Pharmaceuticals ETF)
171,PXQ,PXQ (Invesco Dynamic Networking ETF)
172,PSI,PSI (Invesco Dynamic Semiconductors ETF)
173,PSJ,PSJ (Invesco Dynamic Software ETF)
174,EFG,EFG (iShares MSCI EAFE Growth ETF)
175,EFV,EFV (iShares MSCI EAFE Value ETF)
176,IWC,IWC (iShares Micro-Cap ETF)
177,PZI,PZI (Invesco Zacks Micro Cap ETF)
178,PID,PID (Invesco International Dividend Achievers ETF)
179,PFM,PFM (Invesco Dividend Achievers ETF)
180,FDM,FDM (First Trust Dow Jones Select Microcap Index Fund)
181,PMR,PMR (Invesco Dynamic Retail ETF)
182,PXJ,PXJ (Invesco Dynamic Oil & Gas Services ETF)
183,PXE,PXE (Invesco Dynamic Energy Exploration & Production ETF)
184,PPA,PPA (Invesco Aerospace & Defense ETF)
185,PKB,PKB (Invesco Dynamic Building & Construction ETF)
186,PUI,PUI (Invesco DWA Utilities Momentum ETF)
187,KBE,KBE (SPDR S&P Bank ETF)
188,KCE,KCE (SPDR S&P Capital Markets ETF)
189,KIE,KIE (SPDR S&P Insurance ETF)
190,SLY,SLY (SPDR S&P 600 Small CapETF)
191,SPLG,SPLG (SPDR Portfolio Large Cap ETF)
192,MDYV,MDYV (SPDR S&P 400 Mid Cap Value ETF)
193,MDYG,MDYG (SPDR S&P 400 Mid CapGrowth ETF)
194,SPMD,SPMD (SPDR Portfolio Mid Cap ETF)
195,SDY,SDY (SPDR S&P Dividend ETF)
196,PHO,PHO (Invesco Water Resources ETF)
197,SPHQ,SPHQ (Invesco S&P 500 Quality ETF)
198,FXE,FXE (Invesco CurrencyShares Euro Trust)
199,PRF,PRF (Invesco FTSE RAFI US 1000 ETF)
200,XHB,XHB (SPDR S&P Homebuilders ETF)
201,XBI,XBI (SPDR S&P Biotech ETF)
202,XSD,XSD (SPDR S&P Semiconductor ETF)
203,DBC,DBC (Invesco DB Commodity Index Tracking Fund)
204,RZV,RZV (Invesco S&P SmallCap 600 Pure Value ETF)
205,RFV,RFV (Invesco S&P MidCap 400 Pure Value ETF)
206,RZG,RZG (Invesco S&P SmallCap 600 Pure Growth ETF)
207,RPV,RPV (Invesco S&P 500 Pure Value ETF)
208,RFG,RFG (Invesco S&P MidCap 400 Pure Growth ETF)
209,RPG,RPG (Invesco S&P 500 Pure Growth ETF)
210,FDL,FDL (First Trust Morningstar Dividend Leaders Index)
211,USO,USO (United States Oil Fund LP)
212,FPX,FPX (First Trust US Equity Opportunities ETF)
213,QQEW,QQEW (First Trust NASDAQ 100 Equal Weighted Index Fund)
214,QTEC,QTEC (First Trust NASDAQ 100 Technology Index Fund)
215,SLV,SLV (iShares Silver Trust)
216,VIG,VIG (Vanguard Dividend Appreciation ETF)
217,ITB,ITB (iShares U.S. Home Construction ETF)
218,IEZ,IEZ (iShares U.S. Oil Equipment & Services ETF)
219,IEO,IEO (iShares U.S. Oil & Gas Exploration & Production ETF)
220,IAT,IAT (iShares US Regional Banks ETF)
221,IAI,IAI (iShares U.S. Broker-Dealers & Securities Exchanges ETF)
222,IAK,IAK (iShares U.S. Insurance ETF)
223,IHI,IHI (iShares U.S. Medical Devices ETF)
224,IHF,IHF (iShares U.S. Healthcare Providers ETF)
225,IHE,IHE (iShares US Pharmaceuticals ETF)
226,ITA,ITA (iShares U.S. Aerospace & Defense ETF)
227,GDX,GDX (VanEck Vectors Gold Miners ETF)
228,RYJ,RYJ (Invesco Raymond James SB-1 Equity ETF)
229,DJP,DJP (iPath Bloomberg Commodity Index Total Return ETN)
230,GSP,GSP (iPath GSCI Total Return Index ETN)
231,DLN,DLN (WisdomTree U.S. LargeCap Dividend Fund)
232,DTD,DTD (WisdomTree Total U.S. Dividend Fund)
233,DTN,DTN (WisdomTree U.S. Dividend ex-Financials Fund)
234,DES,DES (WisdomTree U.S. SmallCap Dividend Fund)
235,DHS,DHS (WisdomTree U.S. High Dividend Fund)
236,DON,DON (WisdomTree U.S. MidCap Dividend Fund)
237,AXJL,AXJL (WisdomTree Asia-Pacific ex-Japan Fund)
238,DOL,DOL (WisdomTree International LargeCap Dividend Fund)
239,DWM,DWM (WisdomTree International Equity Fund)
240,DXJ,DXJ (WisdomTree Japan Hedged Equity Fund)
241,DIM,DIM (WisdomTree International MidCap Dividend Fund)
242,DEW,DEW (WisdomTree Global High Dividend Fund)
243,DFE,DFE (WisdomTree Europe SmallCap Dividend Fund)
244,DLS,DLS (WisdomTree International SmallCap Dividend Fund)
245,AUSE,AUSE (WisdomTree Australia Dividend Fund)
246,DNL,DNL (WisdomTree Global ex U.S. Quality Dividend Growth Fund)
247,DOO,DOO (WisdomTree International Dividend Ex-Financials Fund)
248,DTH,DTH (WisdomTree International High Dividend Fund)
249,DFJ,DFJ (WisdomTree Japan SmallCap Dividend Fund)
250,FBT,FBT (First Trust NYSE Arca Biotechnology Index Fund)
251,FDN,FDN (First Trust Dow Jones Internet Index Fund)
252,SH,SH (ProShares Short S&P500)
253,QLD,QLD (ProShares Ultra QQQ)
254,DOG,DOG (ProShares Short Dow30)
255,MVV,MVV (ProShares Ultra MidCap400)
256,MYY,MYY (ProShares Short MidCap 400)
257,PSQ,PSQ (ProShares Short QQQ)
258,DDM,DDM (ProShares Ultra Dow30)
259,SSO,SSO (ProShares Ultra S&P500)
260,XRT,XRT (SPDR S&P Retail ETF)
261,XES,XES (SPDR S&P Oil & Gas Equipment & Services ETF)
262,XOP,XOP (SPDR S&P Oil & Gas Exploration & Production ETF)
263,KRE,KRE (SPDR S&P Regional Banking ETF)
264,XPH,XPH (SPDR S&P Pharmaceuticals ETF)
265,XME,XME (SPDR S&P Metals & Mining ETF)
266,FXA,FXA (Invesco CurrencyShares Australian Dollar Trust)
267,FXB,FXB (Invesco CurrencyShares British Pound Sterling Trust)
268,FXC,FXC (Invesco CurrencyShares Canadian Dollar Trust)
269,FXF,FXF (Invesco CurrencyShares Swiss Franc Trust)
270,FXS,FXS (Invesco CurrencyShares Swedish Krona Trust)
271,FTCS,FTCS (First Trust Capital Strength ETF)
272,GSG,GSG (iShares S&P GSCI Commodity Indexed Trust)
273,SDS,SDS (ProShares UltraShort S&P500)
274,DXD,DXD (ProShares UltraShort Dow30)
275,MZZ,MZZ (ProShares UltraShort MidCap400)
276,QID,QID (ProShares UltraShort QQQ)
277,VOE,VOE (Vanguard Mid-Cap Value ETF)
278,VOT,VOT (Vanguard Mid-Cap Growth ETF)
279,RXI,RXI (iShares Global Consumer Discretionary ETF)
280,KXI,KXI (iShares Global Consumer Staples ETF)
281,EXI,EXI (iShares Global Industrials ETF)
282,MXI,MXI (iShares Global Materials ETF)
283,JXI,JXI (iShares Global Utilities ETF)
284,DBV,DBV (Invesco DB G10 Currency Harvest Fund)
285,PRFZ,PRFZ (Invesco FTSE RAFI US 1500 Small-Mid ETF)
286,WMCR,WMCR (Invesco Wilshire Micro-Cap ETF)
287,EEB,EEB (Invesco BRIC ETF)
288,NFO,NFO (Invesco Insider Sentiment ETF)
289,CVY,CVY (Invesco Zacks Multi-Asset Income ETF)
290,SLX,SLX (VanEck Vectors Steel Index Fund)
291,EVX,EVX (VanEck Vectors Environmental Services ETF)
292,PEZ,PEZ (Invesco DWA Consumer Cyclicals Momentum ETF)
293,PSL,PSL (Invesco DWA Consumer Staples Momentum ETF)
294,PXI,PXI (Invesco DWA Energy Momentum ETF)
295,PFI,PFI (Invesco DWA Financial Momentum ETF)
296,PTH,PTH (Invesco DWA Healthcare Momentum ETF)
297,PRN,PRN (Invesco DWA Industrials Momentum ETF)
298,PYZ,PYZ (Invesco DWA Basic Materials Momentum ETF)
299,PTF,PTF (Invesco DWA Technology Momentum ETF)
300,PUW,PUW (Invesco WilderHill Progressive Energy ETF)
301,PZD,PZD (Invesco Cleantech ETF)
302,PSP,PSP (Invesco Global Listed Private Equity ETF)
303,RCD,RCD (Invesco S&P 500 Equal Weight Consumer Discretionary ETF)
304,RHS,RHS (Invesco S&P 500 Equal Weight Consumer Staples ETF)
305,RYE,RYE (Invesco S&P 500 Equal Weight Energy ETF)
306,RYF,RYF (Invesco S&P 500 Equal Weight Financials ETF)
307,RYH,RYH (Invesco S&P 500 Equal Weight Health Care ETF)
308,RGI,RGI (Invesco S&P 500 Equal Weight Industrials ETF)
309,RTM,RTM (Invesco S&P 500 Equal Weight Materials ETF)
310,RYT,RYT (Invesco S&P 500 Equal Weight Technology ETF)
311,RYU,RYU (Invesco S&P 500 Equal Weight Utilities ETF)
312,VYM,VYM (Vanguard High Dividend Yield ETF)
313,DSI,DSI (iShares MSCI KLD 400 Social ETF)
314,PGF,PGF (Invesco Financial Preferred ETF)
315,PXMG,PXMG (Invesco Russell MidCap Pure Growth ETF)
316,PXSG,PXSG (Invesco Russell 2000 Pure Growth ETF)
317,PXMV,PXMV (Invesco Russell MidCap Pure Value ETF)
318,PXSV,PXSV (Invesco Russell 2000 Pure Value ETF)
319,EQWM,EQWM (Invesco Russell MidCap Equal Weight ETF)
320,EQWS,EQWS (Invesco Russell 2000 Equal Weight ETF)
321,EQWL,EQWL (Invesco Russell Top 200 Equal Weight ETF)
322,TUSA,TUSA (First Trust Total US Market AlphaDEX ETF)
323,RWX,RWX (SPDR Dow Jones International Real Estate ETF)
324,CSD,CSD (Invesco S&P Spin-Off ETF)
325,DEF,DEF (Invesco Defensive Equity ETF)
326,PKW,PKW (Invesco BuyBack Achievers ETF)
327,IEI,IEI (iShares 3-7 Year Treasury Bond ETF)
328,TLH,TLH (iShares 10-20 Year Treasury Bond ETF)
329,SHV,SHV (iShares Short Treasury Bond ETF)
330,GBF,GBF (iShares Government/Credit Bond ETF)
331,GVI,GVI (iShares Intermediate Government/Credit Bond ETF)
332,IGIB,IGIB (iShares Intermediate-Term Corporate Bond ETF)
333,USIG,USIG (iShares Broad USD Investment Grade Corporate Bond ETF)
334,IGSB,IGSB (iShares Short-Term Corporate Bond ETF)
335,DBP,DBP (Invesco DB Precious Metals Fund)
336,DGL,DGL (Invesco DB Gold Fund)
337,DBB,DBB (Invesco DB Base Metals Fund)
338,DBO,DBO (Invesco DB Oil Fund)
339,DBS,DBS (Invesco DB Silver Fund)
340,DBE,DBE (Invesco DB Energy Fund)
341,DBA,DBA (Invesco DB Agriculture Fund)
342,CWI,CWI (SPDR MSCI ACWI ex-US ETF)
343,UWM,UWM (ProShares Ultra Russell2000)
344,SAA,SAA (ProShares Ultra SmallCap600)
345,SBB,SBB (ProShares Short SmallCap600)
346,SDD,SDD (ProShares UltraShort SmallCap600)
347,RWM,RWM (ProShares Short Russell2000)
348,TWM,TWM (ProShares UltraShort Russell2000)
349,GII,GII (SPDR S&P Global Infrastructure ETF)
350,SCC,SCC (ProShares UltraShort Consumer Services)
351,UCC,UCC (ProShares Ultra Consumer Services)
352,SZK,SZK (ProShares UltraShort Consumer Goods)
353,UGE,UGE (ProShares Ultra Consumer Goods)
354,DUG,DUG (ProShares UltraShort Oil & Gas)
355,DIG,DIG (ProShares Ultra Oil & Gas)
356,UYG,UYG (ProShares Ultra Financials)
357,URE,URE (ProShares Ultra Real Estate)
358,SRS,SRS (ProShares UltraShort Real Estate)
359,RXL,RXL (ProShares Ultra Health Care)
360,RXD,RXD (ProShares UltraShort Health Care)
361,SIJ,SIJ (ProShares UltraShort Industrials)
362,UXI,UXI (ProShares Ultra Industrials)
363,SMN,SMN (ProShares UltraShort Basic Materials)
364,UYM,UYM (ProShares Ultra Basic Materials)
365,ROM,ROM (ProShares Ultra Technology)
366,REW,REW (ProShares UltraShort Technology)
367,USD,USD (ProShares Ultra Semiconductors)
368,SSG,SSG (ProShares UltraShort Semiconductors)
369,UPW,UPW (ProShares Ultra Utilities)
370,SDP,SDP (ProShares UltraShort Utilities)
371,QCLN,QCLN (First Trust NASDAQ Clean Edge Green Energy Index Fund)
372,QQXT,QQXT (First Trust NASDAQ 100 Ex-Technology Sector IndexSM Fund)
373,FXY,FXY (Invesco CurrencyShares Japanese Yen Trust)
374,UUP,UUP (Invesco DB US Dollar Index Bullish Fund)
375,UDN,UDN (Invesco DB US Dollar Index Bearish Fund)
376,SKF,SKF (ProShares UltraShort Financials)
377,EPS,EPS (WisdomTree U.S. Earnings 500 Fund)
378,EXT,EXT (WisdomTree U.S. Total Earnings Fund)
379,QSY,QSY (WisdomTree U.S. Quality Shareholder Yield Fund)
380,EES,EES (WisdomTree U.S. SmallCap Earnings Fund)
381,EZM,EZM (WisdomTree U.S. MidCap Earnings Fund)
382,PDP,PDP (Invesco DWA Momentum ETF)
383,VEU,VEU (Vanguard FTSE All-World ex-US ETF)
384,MBB,MBB (iShares MBS ETF)
385,GXC,GXC (SPDR S&P China ETF)
386,SPEM,SPEM (SPDR Portfolio Emerging Markets ETF)
387,GMF,GMF (SPDR S&P Emerging Asia Pacific ETF)
388,PFF,PFF (iShares US Preferred Stock ETF)
389,CZA,CZA (Invesco Zacks Mid-Cap ETF)
390,BLV,BLV (Vanguard Long-Term Bond ETF)
391,BIV,BIV (Vanguard Intermediate-Term Bond ETF)
392,BND,BND (Vanguard Total Bond Market ETF)
393,BSV,BSV (Vanguard Short-Term Bond ETF)
394,HYG,HYG (iShares iBoxx $ High Yield Corporate Bond ETF)
395,UNG,UNG (United States Natural Gas Fund LP)
396,SPDW,SPDW (SPDR Portfolio Developed World ex-US ETF)
397,GWX,GWX (SPDR S&P International Small Cap ETF)
398,RSX,RSX (VanEck Vectors Russia ETF)
399,USRT,USRT (iShares Core U.S. REIT ETF)
400,REZ,REZ (iShares Residential Real Estate ETF)
401,REM,REM (iShares Mortgage Real Estate Capped ETF)
402,GEX,GEX (VanEck Vectors Global Alternative Energy ETF)
403,FXD,FXD (First Trust Consumer Discretionary AlphaDEX Fund)
404,FXG,FXG (First Trust Consumer Staples AlphaDEX Fund)
405,FXN,FXN (First Trust Energy AlphaDEX Fund)
406,FCG,FCG (First Trust Natural Gas ETF)
407,FXO,FXO (First Trust Financial AlphaDEX Fund)
408,FRI,FRI (First Trust S&P REIT Index Fund)
409,FXH,FXH (First Trust Health Care AlphaDEX Fund)
410,FXR,FXR (First Trust Industrials/Producer Durables AlphaDEX Fund)
411,FXZ,FXZ (First Trust Materials AlphaDEX Fund)
412,FNI,FNI (First Trust Chindia ETF)
413,FIW,FIW (First Trust Water ETF)
414,FAD,FAD (First Trust MultiCap Growth AlphaDEX Fund)
415,FAB,FAB (First Trust Multi Cap Value AlphaDEX Fund)
416,FYX,FYX (First Trust Small Cap Core AlphaDEX Fund)
417,FNX,FNX (First Trust Mid Cap Core AlphaDEX Fund)
418,FTC,FTC (First Trust Large Cap Growth AlphaDEX Fund)
419,FTA,FTA (First Trust Large Cap Value AlphaDEX Fund)
420,FEX,FEX (First Trust Large Cap Core AlphaDEX Fund)
421,FXL,FXL (First Trust Technology AlphaDEX Fund)
422,FXU,FXU (First Trust Utilities AlphaDEX Fund)
423,CGW,CGW (Invesco S&P Global Water Index ETF)
424,BIL,BIL (SPDR Bloomberg Barclays 1-3 Month T-Bill ETF)
425,ITE,ITE (SPDR Bloomberg Barclays Intermediate Term Treasury ETF)
426,SPTL,SPTL (SPDR Portfolio Long Term Treasury ETF)
427,SPAB,SPAB (SPDR Portfolio Aggregate Bond ETF)
428,IPE,IPE (SPDR Bloomberg Barclays TIPS ETF)
429,DRW,DRW (WisdomTree Global ex-US Real Estate Fund)
430,IDV,IDV (iShares International Select Dividend ETF)
431,PBD,PBD (Invesco Global Clean Energy ETF)
432,IDHQ,IDHQ (Invesco S&P International Developed Quality ETF)
433,PIO,PIO (Invesco Global Water ETF)
434,LVL,LVL (Invesco S&P Global Dividend Opportunities Index ETF)
435,PXF,PXF (Invesco FTSE RAFI Developed Markets ex-U.S. ETF)
436,PAF,PAF (Invesco FTSE RAFI Asia Pacific ex-Japan ETF)
437,ENY,ENY (Invesco Canadian Energy Income ETF)
438,HGI,HGI (Invesco Zacks International Multi-Asset Income ETF)
439,DEM,DEM (WisdomTree Emerging Markets High Dividend Fund)
440,VEA,VEA (Vanguard FTSE Developed Markets ETF)
441,WPS,WPS (iShares International Developed Property ETF)
442,GSC,GSC (GS Connect S&P GSCI Enhanced Commodity Total Return Strategy Index ETN)
443,EEH,EEH (ELEMENTS SPECTRUM ETN)
444,NLR,NLR (VanEck Vectors Uranium+Nuclear Energy ETF)
445,FFR,FFR (First Trust FTSE EPRA/NAREIT Developed Markets Real Estate Index Fund)
446,FDD,FDD (First Trust Stoxx European Select Dividend Index Fund)
447,MOO,MOO (VanEck Vectors Agribusiness ETF)
448,MUB,MUB (iShares National Muni Bond ETF)
449,TFI,TFI (SPDR Nuveen Barclays Municipal Bond ETF)
450,PDN,PDN (Invesco FTSE RAFI Developed Markets ex-U.S. Small-Mid ETF)
451,PXH,PXH (Invesco FTSE RAFI Emerging Markets ETF)
452,BWX,BWX (SPDR Bloomberg Barclays International Treasury Bond ETF)
453,CMF,CMF (iShares California Muni Bond ETF)
454,NYF,NYF (iShares New York Muni Bond ETF)
455,SHM,SHM (SPDR Nuveen Barclays Short Term Municipal Bond ETF)
456,PLW,PLW (Invesco 1-30 Laddered Treasury ETF)
457,PWZ,PWZ (Invesco California AMT-Free Municipal Bond ETF)
458,PZT,PZT (Invesco New York AMT-Free Municipal Bond ETF)
459,PZA,PZA (Invesco National AMT-Free Municipal Bond ETF)
460,PCY,PCY (Invesco Emerging Markets Sovereign Debt ETF)
461,GCE,GCE (Claymore CEF GS Connect ETN)
462,RJA,RJA (ELEMENTS Linked to the Rogers International Commodity Index - Agri Tot Return)
463,RJI,RJI (ELEMENTS Linked to the Rogers International Commodity Index - Total Return)
464,RJN,RJN (ELEMENTS Linked to the Rogers International Commodity Index - Energy To Return)
465,RJZ,RJZ (ELEMENTS Linked to the Rogers International Commodity Index - Metals Tot Return)
466,WMW,WMW (ELEMENTS Linked to the Morningstar Wide Moat Focus Total Return Index)
467,EFZ,EFZ (ProShares Short MSCI EAFE)
468,EFU,EFU (ProShares UltraShort MSCI EAFE)
469,EEV,EEV (ProShares UltraShort MSCI Emerging Markets)
470,EUM,EUM (ProShares Short MSCI Emerging Markets)
471,DGS,DGS (WisdomTree Emerging Markets SmallCap Dividend Fund)
472,EWV,EWV (ProShares UltraShort MSCI Japan)
473,FXP,FXP (ProShares UltraShort FTSE China 50)
474,DOD,DOD (ELEMENTS - Dogs of the Dow Linked to the DJ High Yield Select TR Index)
475,CUT,CUT (Invesco MSCI Global Timber ETF)
476,IFEU,IFEU (iShares Europe Developed Real Estate ETF)
477,IFGL,IFGL (iShares International Developed Real Estate ETF)
478,IEUS,IEUS (iShares MSCI Europe Small-Cap ETF)
479,ECH,ECH (iShares MSCI Chile ETF)
480,BKF,BKF (iShares MSCI BRIC ETF)
481,AIA,AIA (iShares Asia 50 ETF)
482,PVI,PVI (Invesco VRDO Tax-Free Weekly ETF)
483,PHB,PHB (Invesco Fundamental High Yield Corporate Bond ETF)
484,FGD,FGD (First Trust DJ Global Select Dividend Index Fund)
485,JNK,JNK (SPDR Bloomberg Barclays High Yield Bond ETF)
486,ITM,ITM (VanEck Vectors Intermediate Municipal ETF)
487,USL,USL (United States 12 Month Oil Fund LP)
488,EDV,EDV (Vanguard Extended Duration Treasury ETF)
489,TOK,TOK (iShares MSCI Kokusai ETF)
490,SCZ,SCZ (iShares MSCI EAFE Small-Cap ETF)
491,IGF,IGF (iShares Global Infrastructure ETF)
492,EMB,EMB (iShares JP Morgan USD Emerging Markets Bond ETF)
493,MGC,MGC (Vanguard Mega Cap ETF)
494,MGK,MGK (Vanguard Mega Cap Growth ETF)
495,MGV,MGV (Vanguard Mega Cap Value ETF)
496,TAO,TAO (Invesco China Real Estate ETF)
497,SCJ,SCJ (iShares MSCI Japan Small-Cap ETF)
498,PBP,PBP (Invesco S&P 500 BuyWrite ETF)
499,PIZ,PIZ (Invesco DWA Developed Markets Momentum ETF)
500,PIE,PIE (Invesco DWA Emerging Markets Momentum ETF)
501,MLN,MLN (VanEck Vectors Long Municipal Index ETF)
502,KOL,KOL (VanEck Vectors Coal ETF)
503,BJK,BJK (VanEck Vectors Gaming ETF)
504,GCC,GCC (WisdomTree Continuous Commodity Index Fund)
505,HAO,HAO (Invesco China Small Cap ETF)
506,PGX,PGX (Invesco Preferred ETF)
507,FUE,FUE (ELEMENTS Linked to the MLCX Biofuels Index Total Return)
508,GRU,GRU (ELEMENTS Linked to the MLCX Grains Index Total Return)
509,GSY,GSY (Invesco Ultra Short Duration ETF)
510,DWX,DWX (SPDR S&P International Dividend ETF)
511,RWL,RWL (Oppenheimer S&P 500 Revenue ETF)
512,RWJ,RWJ (Oppenheimer S&P SmallCap 600 Revenue ETF)
513,RWK,RWK (Oppenheimer S&P MidCap 400 Revenue ETF)
514,SMB,SMB (VanEck Vectors Short Municipal ETF)
515,EPI,EPI (WisdomTree India Earnings Fund)
516,UGA,UGA (United States Gasoline Fund LP)
517,DGP,DGP (DB Gold Double Long ETN)
518,DGZ,DGZ (DB Gold Short ETN)
519,DZZ,DZZ (DB Gold Double Short ETN)
520,PIN,PIN (Invesco India ETF)
521,WIP,WIP (SPDR FTSE International Government Inflation-Protected Bond ETF)
522,CNY,CNY (VanEck Vectors Renminbi/USD ETN)
523,INR,INR (VanEck Vectors Rupee/USD ETN)
524,LTL,LTL (ProShares Ultra Telecommunications)
525,ACWX,ACWX (iShares MSCI ACWI ex US ETF)
526,ACWI,ACWI (iShares MSCI ACWI ETF)
527,TUR,TUR (iShares MSCI Turkey ETF)
528,EIS,EIS (iShares MSCI Israel ETF)
529,THD,THD (iShares MSCI Thailand ETF)
530,FUD,FUD (ETRACS CMCI Food Total Return ETN)
