,ticker,name
1474,XINA,XINA (SPDR MSCI China A Shares IMI ETF)
1475,EDOM,EDOM (WisdomTree Europe Domestic Economy Fund)
1476,ITEQ,ITEQ (BlueStar Israel Technology ETF)
1477,FCVT,FCVT (First Trust SSI Strategic Convertible Securities ETF)
1478,IDLB,IDLB (Invesco FTSE International Low Beta Equal Weight ETF)
1479,USLB,USLB (Invesco Russell 1000 Low Beta Equal Weight ETF)
1480,GSIE,GSIE (Goldman Sachs ActiveBeta International Equity ETF)
1481,TLDH,TLDH (FlexShares Currency Hedged Morningstar DM ex-US Factor Tilt Index Fund)
1482,TLEH,TLEH (FlexShares Currency Hedged Morningstar EM Factor Tilt Index Fund)
1483,IAGG,IAGG (iShares Core International Aggregate Bond ETF)
1484,PRME,PRME (First Trust Heitman Global Prime Real Estate ETF)
1485,GSD,GSD (WisdomTree Global SmallCap Dividend Fund)
1486,ETHO,ETHO (Etho Climate Leadership US ETF)
1487,HGSD,HGSD (WisdomTree Global Hedged SmallCap Dividend Fund)
1488,DEEF,DEEF (Xtrackers FTSE Developed ex US Comprehensive Factor ETF)
1489,DEUS,DEUS (Xtrackers Russell 1000 Comprehensive Factor ETF)
1490,ASET,ASET (Flexshares Real Assets Allocation Index Fund)
1491,SPYX,SPYX (SPDR S&P Fossil Fuel Reserves Free ETF)
1492,QMOM,QMOM (Alpha Architect US Quantitative Momentum ETF)
1493,ONEY,ONEY (SPDR Russell 1000 Yield Focus ETF)
1494,ONEO,ONEO (SPDR Russell 1000 Momentum Focus ETF)
1495,ONEV,ONEV (SPDR Russell 1000 Low Volatility Focus ETF)
1496,GASX,GASX (Direxion Daily Natural Gas Related Bear 3x Shares)
1497,MJ,MJ (ETFMG Alternative Harvest ETF)
1498,EMGF,EMGF (iShares Edge MSCI Multifactor Emerging Markets ETF)
1499,PTEU,PTEU (Pacer Trendpilot European Index ETF)
1500,DJD,DJD (Invesco Dow Jones Industrial Average Dividend ETF)
1501,NANR,NANR (SPDR S&P North American Natural Resources ETF)
1502,JPEU,JPEU (JPMorgan Diversified Return Europe Equity ETF)
1503,DYLS,DYLS (WisdomTree Dynamic Long/Short U.S. Equity Fund)
1504,DYB,DYB (WisdomTree Dynamic Bearish U.S. Equity Fund)
1505,IMOM,IMOM (Alpha Architect International Quantitative Momentum ETF)
1506,UDBI,UDBI (Legg Mason US Diversified Core ETF)
1507,DDBI,DDBI (Legg Mason Developed EX-US Diversified Core ETF)
1508,EDBI,EDBI (Legg Mason Emerging Markets Diversified Core ETF)
1509,LVHD,LVHD (Legg Mason Low Volatility High Dividend ETF)
1510,LEAD,LEAD (Reality Shares DIVCON Leaders Dividend ETF)
1511,DEWJ,DEWJ (iShares Adaptive Currency Hedged MSCI Japan ETF)
1512,DEZU,DEZU (iShares Adaptive Currency Hedged MSCI Eurozone ETF)
1513,DEFA,DEFA (iShares Adaptive Currency Hedged MSCI EAFE ETF)
1514,DDLS,DDLS (WisdomTree Dynamic Currency Hedged International SmallCap Equity Fund)
1515,DDWM,DDWM (WisdomTree Dynamic Currency Hedged International Equity Fund)
1516,DDEZ,DDEZ (WisdomTree Dynamic Currency Hedged Europe Equity Fund)
1517,DDJP,DDJP (WisdomTree Dynamic Currency Hedged Japan Equity Fund)
1518,GNRX,GNRX (VanEck Vectors Generic Drugs ETF)
1519,XITK,XITK (SPDR FactSet Innovative Technology ETF)
1520,DFND,DFND (Reality Shares DIVCON Dividend Defender ETF)
1521,GARD,GARD (Reality Shares DIVCON Dividend Guard ETF)
1522,EMDV,EMDV (ProShares MSCI Emerging Markets Dividend Growers ETF)
1523,MLPQ,MLPQ (ETRACS 2xMonthly Leveraged Alerian MLP Infrastructure Index ETN Series B)
1524,MLPZ,MLPZ (ETRACS 2xMonthly Leveraged S&P MLP Index ETN Series B)
1525,GTO,GTO (Invesco Total Return Bond ETF)
1526,FIEE,FIEE (UBS AG FI Enhanced Europe 50 ETN)
1527,FUT,FUT (ProShares Managed Futures Strategy ETF)
1528,OILX,OILX (ETRACS S&P GSCI Crude Oil Total Return Index ETN)
1529,FIHD,FIHD (UBS AG FI Enhanced Global High Yield ETN)
1530,GCOW,GCOW (Pacer Global Cash Cows Dividend ETF)
1531,SOVB,SOVB (Cambria Sovereign Bond ETF)
1532,PUTW,PUTW (WisdomTree CBOE S&P 500 PutWrite Strategy Fund)
1533,JSML,JSML (Janus Small Cap Growth Alpha ETF)
1534,JSMD,JSMD (Janus Small/Mid Cap Growth Alpha ETF)
1535,EVSTC,EVSTC (Eaton Vance Stock NextShares)
1536,VIGI,VIGI (Vanguard International Dividend Appreciation ETF)
1537,VYMI,VYMI (Vanguard International High Dividend Yield ETF)
1538,GSEU,GSEU (Goldman Sachs ActiveBeta Europe Equity ETF)
1539,GSJY,GSJY (Goldman Sachs ActiveBeta Japan Equity ETF)
1540,SHE,SHE (SPDR SSGA Gender Diversity Index ETF)
1541,IFLY,IFLY (ETFMG Drone Economy Strategy ETF)
1542,GAMR,GAMR (ETFMG Video Game Tech ETF)
1543,DWIN,DWIN (Invesco DWA Tactical Multi-Asset Income ETF)
1544,FVC,FVC (First Trust Dorsey Wright Dynamic Focus 5 ETF)
1545,PSET,PSET (Principal Price Setters Index ETF)
1546,PY,PY (Principal Shareholder Yield Index ETF)
1547,CEZ,CEZ (VictoryShares Emerging Market Volatility Wtd ETF)
1548,JHMS,JHMS (John Hancock Multifactor Consumer Staples ETF)
1549,JHME,JHME (John Hancock Multifactor Energy ETF)
1550,JHMI,JHMI (John Hancock Multifactor Industrials ETF)
1551,JHMA,JHMA (John Hancock Multifactor Materials ETF)
1552,JHMU,JHMU (John Hancock Multifactor Utilities ETF)
1553,EVLMC,EVLMC (Eaton Vance TABS 5 to 15 Year Laddered Municipal NextShares)
1554,EVGBC,EVGBC (Eaton Vance Global Income Builder NextShares)
1555,JPIH,JPIH (JPMorgan Diversified Return International Currency Hedged ETF)
1556,JPEH,JPEH (JPMorgan Diversified Return Europe Currency Hedged ETF)
1557,DVEM,DVEM (WisdomTree Emerging Markets Dividend Fund)
1558,IQDG,IQDG (WisdomTree International Quality Dividend Growth Fund)
1559,RFAP,RFAP (First Trust RiverFront Dynamic Asia Pacific ETF)
1560,RFDI,RFDI (First Trust RiverFront Dynamic Developed International ETF)
1561,RFEU,RFEU (First Trust RiverFront Dynamic Europe ETF)
1562,EMTL,EMTL (SPDR DoubleLine Emerging Markets Fixed Income ETF)
1563,STOT,STOT (SPDR DoubleLine Short Duration Total Return Tactical ETF)
1564,CATH,CATH (Global X S&P 500 Catholic Values ETF)
1565,BUZ,BUZ (BUZZ US Sentiment Leaders ETF)
1566,DEMG,DEMG (X-trackers FTSE Emerging Comprehensive Factor ETF)
1567,IBUY,IBUY (Amplify Online Retail ETF)
1568,MPCT,MPCT (iShares Sustainable MSCI Global Impact ETF)
1569,WFIG,WFIG (WisdomTree Fundamental U.S. Corporate Bond Fund)
1570,SFIG,SFIG (WisdomTree Fundamental U.S. Short-Term Corporate Bond Fund)
1571,WFHY,WFHY (WisdomTree Fundamental U.S. High Yield Corporate Bond Fund)
1572,SFHY,SFHY (WisdomTree Fundamental U.S. Short-Term High Yield Corporate Bond Fund)
1573,VMIN,VMIN (REX VOLMAXX Short VIX WeeklyFutures Strategy ETF)
1574,MILN,MILN (Global X Millennials Thematic ETF)
1575,BFIT,BFIT (Global X Health & Wellness Thematic ETF)
1576,LNGR,LNGR (Global X Longevity Thematic ETF)
1577,AGGE,AGGE (IQ Enhanced Core Bond U.S. ETF)
1578,AGGP,AGGP (IQ Enhanced Core Plus Bond U.S. ETF)
1579,OVLC,OVLC (Invesco U.S. Large Cap Optimized Volatility ETF)
1580,JPME,JPME (JPMorgan Diversified Return U.S. Mid Cap Equity ETF)
1581,AMJL,AMJL (X-Links Monthly Pay 2xLeveraged Alerian MLP Index ETN)
1582,FAAR,FAAR (First Trust Alternative Absolute Return Strategy ETF)
1583,IGRO,IGRO (iShares International Dividend Growth ETF)
1584,EPRF,EPRF (Innovator S&P Investment Grade Preferred ETF)
1585,DWFI,DWFI (SPDR Dorsey Wright Fixed Income Allocation ETF)
1586,FLQH,FLQH (Franklin LibertyQ International Equity Hedged ETF)
1587,FLQE,FLQE (Franklin LibertyQ Emerging Markets ETF)
1588,FLQD,FLQD (Franklin LibertyQ Global Dividend ETF)
1589,FLQG,FLQG (Franklin LibertyQ Global Equity ETF)
1590,RFFC,RFFC (RiverFront Dynamic US Flex-Cap ETF)
1591,RFDA,RFDA (RiverFront Dynamic US Dividend Advantage ETF)
1592,SPDN,SPDN (Direxion Daily S&P 500 Bear 1x Shares)
1593,OLD,OLD (The Long-Term Care ETF)
1594,SLIM,SLIM (The Obesity ETF)
1595,ORG,ORG (The Organics ETF)
1596,BEMO,BEMO (Aptus Behavioral Momentum ETF)
1597,ESGS,ESGS (Columbia Sustainable U.S. Equity Income ETF)
1598,ESGN,ESGN (Columbia Sustainable International Equity Income ETF)
1599,ESGW,ESGW (Columbia Sustainable Global Equity Income ETF)
1600,RFUN,RFUN (RiverFront Dynamic Unconstrained Income ETF)
1601,RFCI,RFCI (RiverFront Dynamic Core Income ETF)
1602,RFEM,RFEM (First Trust RiverFront Dynamic Emerging Markets ETF)
1603,CNYA,CNYA (iShares MSCI China A ETF)
1604,HYXE,HYXE (iShares iBoxx $ High Yield ex Oil & Gas Corporate Bond ETF)
1605,FALN,FALN (iShares Fallen Angels USD Bond ETF)
1606,HYDD,HYDD (Direxion Daily High Yield Bear 2x Shares)
1607,DESC,DESC (X-trackers Russell 2000 Comprehensive Factor ETF)
1608,XTH,XTH (SPDR S&P Technology Hardware ETF)
1609,XWEB,XWEB (SPDR S&P Internet ETF)
1610,ESGD,ESGD (iShares MSCI EAFE ESG Optimized ETF)
1611,ESGE,ESGE (iShares MSCI EM ESG Optimized ETF)
1612,OEW,OEW (Invesco S&P 100 Equal Weight ETF)
1613,SCAP,SCAP (Cornerstone Small Cap ETF)
1614,KRMA,KRMA (Global X Conscious Companies ETF)
1615,REML,REML (Credit Suisse X-Links Monthly Pay 2xLeveraged Mortgage REIT ETNs)
1616,DWLV,DWLV (Invesco DWA Momentum & Low Volatility Rotation ETF)
1617,ESG,ESG (FlexShares STOXX US ESG Impact Index Fund)
1618,ESGG,ESGG (FlexShares STOXX Global ESG Impact Index Fund)
1619,EYLD,EYLD (Cambria Emerging Shareholder Yield ETF)
1620,PRNT,PRNT (The 3D Printing ETF)
1621,EUFL,EUFL (Direxion Daily European Financials Bull 2x Shares)
1622,WBIR,WBIR (WBI BullBear Global Rotation ETF)
1623,LVHI,LVHI (Legg Mason International Low Volatility High Dividend ETF)
1624,MLPE,MLPE (C-Tracks ETNs on the Miller/Howard MLP Fundamental Index)
1625,PMPT,PMPT (iSectors Post-MPT Growth ETF)
1626,BTEC,BTEC (Principal Healthcare Innovators Index ETF)
1627,GENY,GENY (Principal Millennials Index ETF)
1628,HUSV,HUSV (First Trust Horizon Managed Volatility Domestic ETF)
1629,HDMV,HDMV (First Trust Horizon Managed Volatility Developed International ETF)
1630,GBIL,GBIL (Goldman Sachs TreasuryAccess 0-1 Year ETF)
1631,SHNY,SHNY (Direxion Daily Silver Miners Index Bull 2x Shares)
1632,SMMV,SMMV (iShares Edge MSCI Min Vol USA Small-Cap ETF)
1633,FINX,FINX (Global X FinTech Thematic ETF)
1634,SNSR,SNSR (Global X Internet of Things Thematic ETF)
1635,BOTZ,BOTZ (Global X Robotics & Artificial Intelligence Thematic ETF)
1636,BSCQ,BSCQ (Invesco BulletShares 2026 Corporate Bond ETF)
1637,BSJO,BSJO (Invesco BulletShares 2024 High Yield Corporate Bond ETF)
1638,JPHF,JPHF (JPMorgan Diversified Alternatives ETF)
1639,FDVV,FDVV (Fidelity Core Dividend ETF)
1640,FDRR,FDRR (Fidelity Dividend ETF for Rising Rates)
1641,FDLO,FDLO (Fidelity Low Volatility Factor ETF)
1642,FDMO,FDMO (Fidelity Momentum Factor ETF)
1643,FQAL,FQAL (Fidelity Quality Factor ETF)
1644,FVAL,FVAL (Fidelity Value Factor ETF)
1645,JPHY,JPHY (JPMorgan Disciplined High Yield ETF)
1646,IBDR,IBDR (iShares iBonds Dec 2026 Term Corporate ETF)
1647,NUAG,NUAG (NuShares Enhanced Yield U.S. Aggregate Bond ETF)
1648,FTXO,FTXO (First Trust Nasdaq Bank ETF)
1649,FTXG,FTXG (First Trust Nasdaq Food & Beverage ETF)
1650,FTXN,FTXN (First Trust Nasdaq Oil & Gas ETF)
1651,FTXH,FTXH (First Trust Nasdaq Pharmaceuticals ETF)
1652,FTXD,FTXD (First Trust Nasdaq Retail ETF)
1653,FTXL,FTXL (First Trust Nasdaq Semiconductor ETF)
1654,FTXR,FTXR (First Trust Nasdaq Transportation ETF)
1655,CWS,CWS (AdvisorShares Focused Equity ETF)
1656,YESR,YESR (Amplify YieldShares Senior Loan and Income ETF)
1657,VRIG,VRIG (Invesco Variable Rate Investment Grade ETF)
1658,PSC,PSC (Principal U.S. Small Cap Index ETF)
1659,FCEF,FCEF (First Trust CEF Income Opportunity ETF)
1660,MCEF,MCEF (First Trust Municipal CEF Income Opportunity ETF)
1661,TTAC,TTAC (TrimTabs All Cap US Free-Cash-Flow ETF)
1662,OILK,OILK (ProShares K 1 Free Crude Oil Strategy ETF)
1663,KOR,KOR (AdvisorShares KIM Korea Equity ETF)
1664,RORE,RORE (Hartford Multifactor REIT ETF)
1665,FLCO,FLCO (Franklin Liberty Investment Grade Corporate ETF)
1666,FLLV,FLLV (Franklin Liberty U.S. Low Volatility ETF)
1667,IVFGC,IVFGC (Ivy Focused Growth NextShares)
1668,IVFVC,IVFVC (Ivy Focused Value NextShares)
1669,IVENC,IVENC (Ivy Energy NextShares)
1670,LVHB,LVHB (Innovator Lunt Low Vol/High Beta Tactical ETF)
1671,EFAX,EFAX (SPDR MSCI EAFE Fossil Fuel Reserves Free ETF)
1672,EEMX,EEMX (SPDR MSCI Emerging Markets Fossil Fuel Reserves Free ETF)
1673,IFIX,IFIX (X-trackers Barclays International Corporate Bond Hedged ETF)
1674,IGVT,IGVT (X-trackers Barclays International Treasury Bond Hedged ETF)
1675,MVIN,MVIN (Natixis Seeyond International Minimum Volatility ETF)
1676,TCTL,TCTL (Premise Capital Frontier Advantage Diversified Tactical ETF)
1677,ESGL,ESGL (Oppenheimer ESG Revenue ETF)
1678,ESGF,ESGF (Oppenheimer Global ESG Revenue ETF)
1679,ACSI,ACSI (American Customer Satisfaction ETF)
1680,CWEB,CWEB (Direxion Daily CSI China Internet Index Bull 2x Shares)
1681,IMTB,IMTB (iShares Core 5-10 Year USD Bond ETF)
1682,DHDG,DHDG (WisdomTree Dynamic Currency Hedged International Quality Dividend Growth Fund)
1683,GVIP,GVIP (Goldman Sachs Hedge Industry VIP ETF)
1684,EFAS,EFAS (Global X MSCI SuperDividend EAFE ETF)
1685,JPSE,JPSE (JPMorgan Diversified Return U.S. Small Cap Equity ETF)
1686,VNLA,VNLA (Janus Short Duration Income ETF)
1687,LVHE,LVHE (Legg Mason Emerging Markets Low Volatility High Dividend ETF)
1688,FLEU,FLEU (FI Enhanced Europe 50 ETN Series B)
1689,OILB,OILB (iPath Series B S&P GSCI Crude Oil Total Return Index ETNs)
1690,BNDC,BNDC (FlexShares Core Select Bond Fund)
1691,MOGLC,MOGLC (Gabelli Media Mogul NextShares)
1692,IDHD,IDHD (Invesco S&P International Developed High Dividend Low Volatility ETF)
1693,XSHD,XSHD (Invesco S&P SmallCap High Dividend Low Volatility ETF)
1694,ESGU,ESGU (iShares MSCI USA ESG Optimized ETF)
1695,BLHY,BLHY (Virtus Newfleet Dynamic Credit ETF)
1696,HYLB,HYLB (X-trackers USD High Yield Corporate Bond ETF)
1697,ARVR,ARVR (Tactile Analytics AR/VR Virtual Technologies ETF)
1698,UWT,UWT (VelocityShares 3x Long Crude Oil ETN)
1699,DWT,DWT (VelocityShares 3x Inverse Crude Oil ETN)
1700,NULG,NULG (NuShares ESG Large-Cap Growth ETF)
1701,NULV,NULV (NuShares ESG Large-Cap Value ETF)
1702,NUMG,NUMG (NuShares ESG Mid-Cap Growth ETF)
1703,NUMV,NUMV (NuShares ESG Mid-Cap Value ETF)
1704,NUSC,NUSC (NuShares ESG Small-Cap ETF)
1705,DIVO,DIVO (Amplify YieldShares CWP Dividend & Option Income ETF)
1706,JHMD,JHMD (John Hancock Multifactor Developed International ETF)
1707,COWZ,COWZ (Pacer US Cash Cows 100 ETF)
1708,BMLP,BMLP (BMO Elkhorn DWA MLP Select Index ETN)
1709,NURE,NURE (NuShares Short-Term REIT ETF)
1710,WBIY,WBIY (WBI Power Factor High Dividend ETF)
1711,INFR,INFR (Legg Mason Global Infrastructure ETF)
1712,WTIU,WTIU (UBS ETRACS - ProShares Daily 3x Long Crude ETN)
1713,WTID,WTID (UBS ETRACS - ProShares Daily 3x Inverse Crude ETN)
1714,SWIN,SWIN (ALPS Dorsey Wright Sector Momentum ETF)
1715,OUSM,OUSM (OShares FTSE Russell US Small Cap Quality Dividend ETF)
1716,DUSA,DUSA (Davis Select U.S. Equity ETF)
1717,DFNL,DFNL (Davis Select Financial ETF)
1718,DWLD,DWLD (Davis Select Worldwide ETF)
1719,CLTL,CLTL (Invesco Treasury Collateral ETF)
1720,CUMB,CUMB (Virtus Cumberland Municipal Bond ETF)
1721,QXGG,QXGG (QuantX Risk Managed Growth ETF)
1722,QXMI,QXMI (QuantX Risk Managed Multi-Asset Income ETF)
1723,QXRR,QXRR (QuantX Risk Managed Real Return ETF)
1724,QXTR,QXTR (QuantX Risk Managed Multi-Asset Total Return ETF)
1725,XUSA,XUSA (QuantX Dynamic Beta US Equity ETF)
1726,FLIO,FLIO (Franklin Liberty International Opportunities ETF)
1727,GLDW,GLDW (SPDR Long Dollar Gold Trust)
1728,PFFR,PFFR (Infracap REIT Preferred ETF)
1729,XMX,XMX (WisdomTree Global ex-Mexico Equity Fund)
1730,FOANC,FOANC (Gabelli Food of All Nations NextShares)
1731,BOSS,BOSS (Global X Founder-Run Companies ETF)
1732,HYLV,HYLV (IQ S&P High Yield Low Volatility Bond ETF)
1733,TBLU,TBLU (Tortoise Water Fund)
1734,FIXD,FIXD (First Trust TCW Opportunistic Fixed Income ETF)
1735,PSMC,PSMC (Invesco Conservative Multi-Asset Allocation ETF)
1736,PSMM,PSMM (Invesco Moderately Conservative Multi-Asset Allocation ETF)
1737,PSMB,PSMB (Invesco Balanced Multi-Asset Allocation ETF)
1738,PSMG,PSMG (Invesco Growth Multi-Asset Allocation ETF)
1739,ISMD,ISMD (Inspire Small/Mid Cap Impact ETF)
1740,BLES,BLES (Inspire Global Hope Large Cap ETF)
1741,GRNB,GRNB (VanEck Vectors Green Bond ETF)
1742,PAVE,PAVE (Global X U.S. Infrastructure Development ETF)
1743,GAZB,GAZB (iPath Series B Bloomberg Natural Gas Subindex Total Return ETN)
1744,CEFS,CEFS (Saba Closed-End Funds ETF)
1745,ONTL,ONTL (OShares FTSE Russell International Quality Dividend ETF)
1746,IDEV,IDEV (iShares Core MSCI International Developed Markets ETF)
1747,OILU,OILU (ProShares UltraPro 3x Crude Oil ETF)
1748,OILD,OILD (ProShares UltraPro 3x Short Crude Oil ETF)
1749,CWAI,CWAI (CWA Income ETF)
1750,COM,COM (Direxion Auspice Broad Commodity Strategy ETF)
1751,BCI,BCI (ETFS Bloomberg All Commodity Strategy K-1 Free ETF)
1752,BCD,BCD (ETFS Bloomberg All Commodity Longer Dated Strategy K-1 Free ETF)
1753,BEF,BEF (ETFS Bloomberg Energy Commodity Longer Dated Strategy K-1 Free ETF)
1754,ARCM,ARCM (Arrow Reserve Capital Management ETF)
1755,NUSA,NUSA (NuShares Enhanced Yield 1-5 Year U.S. Aggregate Bond ETF)
1756,TAIL,TAIL (Cambria Tail Risk ETF)
1757,SPVM,SPVM (Invesco S&P 500 Value With Momentum ETF)
1758,XSHQ,XSHQ (Invesco S&P SmallCap Quality ETF)
1759,JPGB,JPGB (JPMorgan Global Bond Opportunities ETF)
1760,ERM,ERM (EquityCompass Risk Manager ETF)
1761,TERM,TERM (EquityCompass Tactical Risk Manager ETF)
1762,IBML,IBML (iShares iBonds Dec 2023 Term Muni Bond ETF)
1763,ICAN,ICAN (SerenityShares IMPACT ETF)
1764,VSDA,VSDA (Victoryshares Dividend Accelerator ETF)
1765,TETF,TETF (ETF Industry Exposure & Financial Services ETF)
1766,USOI,USOI (X-Links Crude Oil Shares Covered Call ETN)
1767,AGT,AGT (iShares MSCI Argentina and Global Exposure ETF)
1768,FLQL,FLQL (Franklin LibertyQ U.S. Equity ETF)
1769,FLQM,FLQM (Franklin LibertyQ U.S. Mid Cap Equity ETF)
1770,FLQS,FLQS (Franklin LibertyQ US Small Cap Equity ETF)
1771,DFEN,DFEN (Direxion Daily Aerospace & Defense Bull 3X Shares)
1772,DUSL,DUSL (Direxion Daily Industrials Bull 3X Shares)
1773,MEXX,MEXX (Direxion Daily MSCI Mexico Bull 3X Shares)
1774,TPOR,TPOR (Direxion Daily Transportation Bull 3X Shares)
1775,UTSL,UTSL (Direxion Daily Utilities Bull 3X Shares)
1776,EVIX,EVIX (VelocityShares 1X Long VSTOXX Futures ETN)
1777,EXIV,EXIV (VelocityShares 1X Daily Inverse VSTOXX Futures ETN)
1778,VMOT,VMOT (Alpha Architect Value Momentum Trend ETF)
1779,CACG,CACG (ClearBridge All Cap Growth ETF)
1780,GDVD,GDVD (Principal Active Global Dividend Income ETF)
1781,LVIN,LVIN (Hartford Multifactor Low Volatility International Equity ETF)
1782,LVUS,LVUS (Hartford Multifactor Low Volatility US Equity ETF)
1783,CSML,CSML (IQ Chaikin U.S. Small Cap ETF)
1784,SHAG,SHAG (WisdomTree Barclays Yield Enhanced U.S. Short-Term Aggregate Bond Fund)
1785,JPST,JPST (JPMorgan Ultra-Short Income ETF)
1786,COMB,COMB (GraniteShares Bloomberg Commodity Broad Strategy No K-1 ETF)
1787,COMG,COMG (GraniteShares S&P GSCI Commodity Broad Strategy no K-1 ETF)
1788,YLDE,YLDE (ClearBridge Dividend Strategy ESG ETF)
1789,LRGE,LRGE (ClearBridge Large Cap Growth ESG ETF)
1790,CCOR,CCOR (Cambria Core Equity ETF)
1791,FFHG,FFHG (Formula Folios Hedged Growth ETF)
1792,FFTI,FFTI (FormulaFolios Tactical Income ETF)
1793,NUDM,NUDM (NuShares ESG International Developed Markets Equity ETF)
1794,NUEM,NUEM (NuShares ESG Emerging Markets Equity ETF)
1795,GIGB,GIGB (Goldman Sachs Access Investment Grade Corporate Bond ETF)
1796,PPLN,PPLN (Cushing 30 MLP Index ETNs due June 16 2037)
1797,BVAL,BVAL (Brand Value ETF)
1798,ICOW,ICOW (Pacer Developed Markets International Cash Cows 100 ETF)
1799,CALF,CALF (Pacer US Small Cap Cash Cows 100 ETF)
1800,FCAL,FCAL (First Trust California Municipal High Income ETF)
1801,RNDM,RNDM (Developed International Equity Select ETF)
1802,RNEM,RNEM (Emerging Markets Equity Select ETF)
1803,RNLC,RNLC (Large Cap US Equity Select ETF)
1804,RNMC,RNMC (Mid Cap US Equity Select ETF)
1805,RNSC,RNSC (Small Cap US Equity Select ETF)
1806,RNDV,RNDV (US Equity Dividend Select ETF)
1807,GMFL,GMFL (Invesco Multi-Factor Large Cap ETF)
1808,VSMV,VSMV (VictoryShares US Multi-Factor Minimum Volatility ETF)
1809,OCIO,OCIO (ClearShares OCIO ETF)
1810,GOAU,GOAU (U.S. Global GO GOLD and Precious Metal Miners ETF)
1811,VESH,VESH (Virtus Enhanced Short US Equity ETF)
1812,TTAI,TTAI (TrimTabs All Cap International Free Cash-Flow ETF)
1813,USMF,USMF (WisdomTree U.S. Multifactor Fund)
1814,GSSC,GSSC (Goldman Sachs ActiveBeta U.S. Small Cap Equity ETF)
1815,SMMD,SMMD (iShares Russell 2500 ETF)
1816,FANZ,FANZ (ProSports Sponsors ETF)
1817,PREF,PREF (Principal Spectrum Preferred Securities Active ETF)
1818,IBD,IBD (Inspire Corporate Bond Impact ETF)
1819,EUXL,EUXL (Direxion Daily EURO STOXX 50 Bull 3X Shares)
1820,FNG,FNG (AdvisorShares New Tech and Media ETF)
1821,SQLV,SQLV (Legg Mason Small-Cap Quality Value ETF)
1822,SUSB,SUSB (iShares ESG 1-5 Year USD Corporate Bond ETF)
1823,SUSC,SUSC (iShares ESG USD Corporate Bond ETF)
1824,HYDB,HYDB (iShares Edge High Yield Defensive Bond ETF)
1825,IGEB,IGEB (iShares Edge Investment Grade Enhanced Bond ETF)
1826,REEM,REEM (Oppenheimer Emerging Markets Revenue ETF)
1827,RGLB,RGLB (Oppenheimer Global Revenue ETF)
1828,REFA,REFA (Oppenheimer International Revenue ETF)
1829,SPMV,SPMV (Invesco S&P 500 Minimum Variance ETF)
1830,USEQ,USEQ (Invesco Russell 1000 Enhanced Equal Weight ETF)
1831,EQRR,EQRR (Proshares Equities For Rising Rates ETF)
1832,EMXC,EMXC (iShares MSCI Emerging Markets ex China ETF)
1833,USOU,USOU (United States 3x Oil Fund)
1834,USOD,USOD (United States 3x Short Oil Fund)
1835,DMRL,DMRL (Deltashares S&P 500 Managed Risk ETF)
1836,DMRM,DMRM (Deltashares S&P 400 Managed Risk ETF)
1837,DMRS,DMRS (Deltashares S&P 600 Managed Risk ETF)
1838,DMRI,DMRI (Deltashares S&P International Managed Risk ETF)
1839,EDOW,EDOW (First Trust Dow 30 Equal Weight ETF)
1840,AMCA,AMCA (iShares Russell 1000 Pure U.S. Revenue ETF)
1841,ULBR,ULBR (VelocityShares Long LIBOR ETN)
1842,DLBR,DLBR (VelocityShares Short LIBOR ETN)
1843,EMBU,EMBU (Direxion Daily Emerging Markets Bond Bull 3X Shares)
1844,FMDG,FMDG (Fieldstone Merlin Dynamic Large Cap Growth Fund)
1845,FFIU,FFIU (Fieldstone/UVA Unconstrained Medium-Term)
1846,FPEI,FPEI (First Trust Institutional Preferred Securities and Income ETF)
1847,BAR,BAR (Graniteshares Gold Trust)
1848,FLMI,FLMI (Franklin Liberty Intermediate Municipal Opportunities ETF)
1849,FLMB,FLMB (Franklin Liberty Municipal Bond ETF)
1850,MFUS,MFUS (PIMCO RAFI Dynamic Multi-Factor U.S. Equity ETF)
1851,MFDX,MFDX (PIMCO RAFI Dynamic Multi-Factor International Equity ETF)
1852,MFEM,MFEM (PIMCO RAFI Dynamic Multi-Factor Emerging Markets Equity ETF)
1853,SECT,SECT (Main Sector Rotation ETF)
1854,MAGA,MAGA (Point Bridge Gop Stock Tracker ETF)
1855,GHYB,GHYB (Goldman Sachs Access High Yield Corporate Bond ETF)
1856,OBOR,OBOR (KraneShares MSCI One Belt One Road ETF)
1857,PFFD,PFFD (Global X US Preferred ETF)
1858,GSEW,GSEW (Goldman Sachs Equal Weight U.S. Large Cap Equity ETF)
1859,MLQD,MLQD (iShares 5-10 Year Investment Grade Corporate Bond ETF)
1860,LLQD,LLQD (iShares 10+ Year Investment Grade Corporate Bond ETF)
1861,IBDS,IBDS (iShares iBonds Dec 2027 Term Corporate ETF)
1862,RBUS,RBUS (Nationwide Risk-Based US Equity ETF)
1863,RBIN,RBIN (Nationwide Risk-Based International Equity ETF)
1864,MXDU,MXDU (Nationwide Maximum Diversification US Core Equity ETF)
1865,PBUS,PBUS (Invesco PureBeta MSCI USA ETF)
1866,PBSM,PBSM (Invesco PureBeta MSCI USA Small Cap ETF)
1867,PBDM,PBDM (Invesco PureBeta FTSE Developed ex-North America ETF)
1868,PBEE,PBEE (Invesco PureBeta FTSE Emerging Markets ETF)
1869,PBTP,PBTP (Invesco PureBeta 0-5 Yr US TIPS ETF)
1870,BSCR,BSCR (Invesco BulletShares 2027 Corporate Bond ETF)
1871,BSJP,BSJP (Invesco BulletShares 2025 High Yield Corporate Bond ETF)
1872,HTRB,HTRB (Hartford Total Return Bond ETF)
1873,DALT,DALT (Anfield Capital Diversified Alternatives ETF)
1874,PBND,PBND (Invesco PureBeta US Aggregate Bond ETF)
1875,NUBD,NUBD (NuShares ESG US Aggregate Bond ETF)
1876,LFEQ,LFEQ (VanEck Vectors NDR CMG Long/Flat Allocation ETF)
1877,CHGX,CHGX (Change Finance U.S. Large Cap Fossil Fuel Free ETF)
1878,SCHK,SCHK (Schwab 1000 Index ETF)
1879,USMC,USMC (Principal U.S. Mega-Cap Multi-Factor Index ETF)
1880,DIAL,DIAL (Columbia Diversified Fixed Income Allocation ETF)
1881,KGRN,KGRN (KraneShares MSCI China Environment ETF)
1882,BERN,BERN (Bernstein US Research Fund)
1883,BRGL,BRGL (Bernstein Global Research Fund)
1884,PLCY,PLCY (EventShares U.S. Policy Alpha Fund)
1885,MMIN,MMIN (IQ MacKay Shields Municipal Insured ETF)
1886,MMIT,MMIT (IQ MacKay Shields Municipal Intermediate ETF)
1887,AIEQ,AIEQ (AI Powered Equity ETF)
1888,LOGO,LOGO (Global X Iconic US Brands ETF)
1889,PVAL,PVAL (Principal Contrarian Value Index ETF)
1890,PMOM,PMOM (Principal Sustainable Momentum Index ETF)
1891,VGFO,VGFO (Virtus WMC Global Factor Opportunities ETF)
1892,KEMQ,KEMQ (KraneShares Emerging Markets Consumer Technology ETF)
1893,CEY,CEY (VictoryShares Emerging Market High Div Volatility Wtd ETF)
1894,USTB,USTB (USAA Core Short-Term Bond ETF)
1895,UITB,UITB (USAA Core Intermediate-Term Bond ETF)
1896,ULVM,ULVM (USAA MSCI USA Value Momentum Blend Index ETF)
1897,USVM,USVM (USAA MSCI USA Small Cap Value Momentum Blend Index ETF)
1898,UIVM,UIVM (USAA MSCI International Value Momentum Blend Index ETF)
1899,UEVM,UEVM (USAA MSCI Emerging Markets Value Momentum Blend Index ETF)
1900,USHY,USHY (iShares Broad USD High Yield Corporate Bond ETF)
1901,GUDB,GUDB (Sage ESG Intermediate Credit ETF)
1902,BIBL,BIBL (Inspire 100 ETF)
1903,RVRS,RVRS (Reverse Cap Weighted U.S. Large Cap ETF)
1904,FTVA,FTVA (Aptus Fortified Value ETF)
1905,FFSG,FFSG (FormulaFolios Smart Growth ETF)
1906,FFTG,FFTG (FormulaFolios Tactical Growth ETF)
1907,FMHI,FMHI (First Trust Municipal High Income ETF)
1908,SDVY,SDVY (First Trust SMID Cap Rising Dividend Archievers ETF)
1909,FLAU,FLAU (Franklin FTSE Australia ETF)
1910,FLBR,FLBR (Franklin FTSE Brazil ETF)
1911,FLCA,FLCA (Franklin FTSE Canada ETF)
1912,FLCH,FLCH (Franklin FTSE China ETF)
1913,FLFR,FLFR (Franklin FTSE France ETF)
1914,FLGR,FLGR (Franklin FTSE Germany ETF)
1915,FLHK,FLHK (Franklin FTSE Hong Kong ETF)
1916,FLIY,FLIY (Franklin FTSE Italy ETF)
1917,FLJP,FLJP (Franklin FTSE Japan ETF)
1918,FLKR,FLKR (Franklin FTSE South Korea ETF)
